FAWN Station,Period,2m T avg (F),2m T min (F),2m T max (F),Tsoil avg-10cm  (F),Tsoil min(avg)-10cm  (F),Tsoil max(avg)-10cm  (F),2m DewPt avg (F),RelHum avg 2m  (pct),2m Rain tot (in),2m Rain max over 15min (in),SolRad avg2m  (w/m^2),10m Wind avg (mph),10m Wind min (mph),10m Wind max (mph),WDir avg10m  (deg),BP avg (mb),N (# obs),2m WetBulb (F),Year,Month,Day,DayOfWeek,Quarter,WeekOfYear,Season,Temp_Range,Soil_Temp_Range,Temp_Category,Apparent_Temp,Wind_Range,Wind_Category,Wind_Chill,Rain_Category,Has_Rain,Rain_Intensity,Humidity_Comfort,Dewpoint_Comfort,Solar_Category,Comfort_Index,Weather_Severity,Station_Avg_Temp,Station_Avg_Rain,Temp_Deviation_From_Station,Temp_Humidity_Interaction,Wind_Rain_Interaction
Apopka,01/01/2022,73.4,66.4,82.4,72.59,70.05,75.51,65.34,78,0,0,156.5,4.29,0,17.83,196,1014,96,67.97,2022,1,1,5,1,52,Winter,16,5.46,Warm,74.27516,17.83,Calm,73.4,No Rain,0,0,Humid,Uncomfortable,Low,94.39295909,0.3416,72.36885949,0.159908759,1.031140511,5725.2,0
Apopka,02/01/2022,73.41,67.06,81.93,73.3,71.33,76.21,68.16,84,0,0,124.04,5.42,0.13,18.36,221,1013,96,69.8,2022,1,2,6,1,52,Winter,14.87,4.88,Warm,74.355252,18.23,Light,73.41,No Rain,0,0,Very Humid,Uncomfortable,Low,94.07527514,0.3873,72.36885949,0.159908759,1.041140511,6166.44,0
Apopka,03/01/2022,61.63,47.97,71.69,71.53,68.76,73.78,50.1,68,0.03,0.03,178.06,9.36,0.43,28.5,309,1016,96,55.06,2022,1,3,0,1,1,Winter,23.72,5.02,Mild,59.751772,28.07,Light,61.63,Light,1,0.12,Humid,Comfortable,Low,74.86996276,0.8529,72.36885949,0.159908759,-10.73885949,4190.84,0.2808
Apopka,04/01/2022,58.21,43.94,72.05,67.77,64.67,70.65,51.42,80,0,0,144.97,5.12,0.05,16.96,39,1019,96,54.32,2022,1,4,1,1,1,Winter,28.11,5.98,Mild,55.09744,16.91,Light,58.21,No Rain,0,0,Humid,Comfortable,Low,92.77965514,0.7943,72.36885949,0.159908759,-14.15885949,4656.8,0
Apopka,05/01/2022,62.97,54.84,74.03,68.73,66.36,71.55,58.64,87,0,0,116.53,4.12,0.02,14.23,353,1014,96,60.27,2022,1,5,2,1,1,Winter,19.19,5.19,Mild,60.951687,14.21,Calm,62.97,No Rain,0,0,Very Humid,Comfortable,Low,88.35468999,0.5163,72.36885949,0.159908759,-9.398859489,5478.39,0
Apopka,06/01/2022,60.95,51.1,71.62,68.74,65.89,71.56,51.64,74,0,0,164.96,3.28,0,22.12,312,1013,96,55.57,2022,1,6,3,1,1,Winter,20.52,5.67,Mild,58.73999,22.12,Calm,60.95,No Rain,0,0,Humid,Comfortable,Low,85.58830403,0.5837,72.36885949,0.159908759,-11.41885949,4510.3,0
Apopka,07/01/2022,64.25,52.02,73.38,69.54,67.59,72,56.9,77,0.01,0.01,153.47,5.32,0.09,17.34,348,1017,96,59.73,2022,1,7,4,1,1,Winter,21.36,4.41,Mild,62.788925,17.25,Light,64.25,Light,1,0.04,Humid,Comfortable,Low,93.89765875,0.5203,72.36885949,0.159908759,-8.118859489,4947.25,0.0532
Apopka,08/01/2022,62.67,49.24,76.87,68.35,65.12,71.83,54.86,77,0,0,179.11,5.97,0.56,20.45,77,1024,96,57.98,2022,1,8,5,1,1,Winter,27.63,6.71,Mild,60.807447,19.89,Light,62.67,No Rain,0,0,Humid,Comfortable,Low,91.13455853,0.6053,72.36885949,0.159908759,-9.698859489,4825.59,0
Apopka,09/01/2022,69.15,58.66,81.99,69.71,66.74,73.06,62.49,81,0,0,132.61,4.81,0.02,22.15,121,1023,96,64.8,2022,1,9,6,1,1,Winter,23.33,6.32,Mild,68.922795,22.13,Calm,69.15,No Rain,0,0,Very Humid,Sticky,Low,98.12045647,0.2349,72.36885949,0.159908759,-3.218859489,5601.15,0
Apopka,10/01/2022,66.62,57.13,76.5,70.59,68.63,72.39,62.79,88,0.01,0.01,107.15,6.08,0,22.5,299,1020,96,64.12,2022,1,10,0,1,2,Winter,19.37,3.76,Mild,65.638448,22.5,Light,66.62,Light,1,0.04,Very Humid,Sticky,Low,89.66369968,0.4322,72.36885949,0.159908759,-5.748859489,5862.56,0.0608
Apopka,11/01/2022,57.51,48.58,69.28,68.5,65.91,70.63,47.6,71,0,0,167.87,8.22,0.25,22.12,25,1023,96,52.08,2022,1,11,1,1,2,Winter,20.7,4.72,Mild,54.583593,21.87,Light,57.51,No Rain,0,0,Humid,Dry,Low,77.63224195,0.9533,72.36885949,0.159908759,-14.85885949,4083.21,0
Apopka,12/01/2022,60.42,50.88,72.21,67.49,64.87,70.21,51.43,75,0,0,150.64,5.81,0.76,17.76,49,1019,96,55.24,2022,1,12,2,1,2,Winter,21.33,5.34,Mild,58.04895,17,Light,60.42,No Rain,0,0,Humid,Comfortable,Low,88.85254445,0.7114,72.36885949,0.159908759,-11.94885949,4531.5,0
Apopka,13/01/2022,60.15,51.44,70.23,68.22,65.64,71.13,52.41,77,0.03,0.03,174.85,6.15,0.02,24.43,305,1012,96,55.65,2022,1,13,3,1,2,Winter,18.79,5.49,Mild,57.647115,24.41,Light,60.15,Light,1,0.12,Humid,Comfortable,Low,89.11658726,0.7985,72.36885949,0.159908759,-12.21885949,4631.55,0.1845
Apopka,14/01/2022,56.07,48.67,65.93,66.72,64.31,69.19,43.18,65,0,0,184.65,5.77,0,17.6,303,1011,96,49.38,2022,1,14,4,1,2,Winter,17.26,4.88,Mild,53.082015,17.6,Light,56.07,No Rain,0,0,Humid,Dry,Low,79.47418284,0.9273,72.36885949,0.159908759,-16.29885949,3644.55,0
Apopka,15/01/2022,56.88,40.92,72.5,65.19,61.72,68.54,46.17,71,0,0,175.92,3.24,0,15.64,168,1013,96,51.11,2022,1,15,5,1,2,Winter,31.58,6.82,Mild,53.805984,15.64,Calm,56.88,No Rain,0,0,Humid,Dry,Low,80.96637059,0.7856,72.36885949,0.159908759,-15.48885949,4038.48,0
Apopka,16/01/2022,62.23,57.76,66.7,65.82,64.13,66.78,54.57,76,0.54,0.3,70.24,12.94,1.25,38.23,230,1005,96,57.65,2022,1,16,6,1,2,Winter,8.94,2.65,Mild,60.281284,36.98,Moderate,62.23,Heavy,1,1.2,Humid,Comfortable,Low,70.74617783,1.9861,72.36885949,0.159908759,-10.13885949,4729.48,6.9876
Apopka,17/01/2022,53.48,46.96,58.89,63.05,61.12,65.01,45.05,74,0,0,171.31,11.17,0.92,28.97,292,1011,96,49.05,2022,1,17,0,1,3,Winter,11.93,3.89,Mild,49.445816,28.05,Moderate,53.48,No Rain,0,0,Humid,Dry,Low,69.04338471,1.2728,72.36885949,0.159908759,-18.88885949,3957.52,0
Apopka,18/01/2022,46.39,36.27,57.63,61.11,57.92,64.2,38.45,75,0,0,191.74,4.53,0.05,16.33,336,1019,96,42.66,2022,1,18,1,1,3,Winter,21.36,6.28,Cold,40.546525,16.28,Calm,44.30054641,No Rain,0,0,Humid,Dry,Low,81.00205123,1.3617,72.36885949,0.159908759,-25.97885949,3479.25,0
Apopka,19/01/2022,56.36,40.16,71.8,61.09,57.38,65.03,48.34,76,0,0,145.46,4.14,0.34,17.16,86,1019,96,51.94,2022,1,19,2,1,3,Winter,31.64,7.65,Mild,52.939088,16.82,Calm,56.36,No Rain,0,0,Humid,Dry,Low,86.59973523,0.8476,72.36885949,0.159908759,-16.00885949,4283.36,0
Apopka,20/01/2022,62.34,49.19,76.41,63.78,59.97,68.04,54.31,78,0,0,185.61,3.45,0.02,12.08,214,1016,96,57.55,2022,1,20,3,1,3,Winter,27.22,8.07,Mild,60.368316,12.06,Calm,62.34,No Rain,0,0,Humid,Comfortable,Low,89.64776465,0.521,72.36885949,0.159908759,-10.02885949,4862.52,0
Apopka,21/01/2022,61.37,52.93,71.33,65.62,62.83,68.65,57.21,87,0,0,115.27,4.62,0.02,19.35,23,1015,96,58.82,2022,1,21,4,1,3,Winter,18.4,5.82,Mild,58.892327,19.33,Calm,61.37,No Rain,0,0,Very Humid,Comfortable,Low,88.78642145,0.6163,72.36885949,0.159908759,-10.99885949,5339.19,0
Apopka,22/01/2022,49.16,43.28,54.05,63.73,61.14,66.67,48.39,97,0.01,0.01,22.4,7.42,0.6,21.85,11,1018,96,48.74,2022,1,22,5,1,3,Winter,10.77,5.53,Cold,42.489116,21.25,Light,45.98862989,Light,1,0.04,Very Humid,Dry,Low,69.23744492,1.3588,72.36885949,0.159908759,-23.20885949,4768.52,0.0742
Apopka,23/01/2022,43.31,38.29,49.62,59.94,58.21,61.09,40.17,89,0,0,93.69,6.24,0.63,16.35,323,1016,96,41.82,2022,1,23,6,1,3,Winter,11.33,2.88,Cold,35.471147,15.72,Light,39.55566435,No Rain,0,0,Very Humid,Dry,Low,74.50697866,1.5841,72.36885949,0.159908759,-29.05885949,3854.59,0
Apopka,24/01/2022,46.99,33.39,58.8,58.06,54.14,61.97,34.37,67,0,0,191.17,3.82,0,13.78,292,1013,96,41.34,2022,1,24,0,1,4,Winter,25.41,7.83,Cold,41.902489,13.78,Calm,45.53671691,No Rain,0,0,Humid,Dry,Low,73.88475831,1.3033,72.36885949,0.159908759,-25.37885949,3148.33,0
Apopka,25/01/2022,49.34,47.17,52.57,58.88,58.3,59.76,44.25,83,0.22,0.03,32.22,3.26,0.07,12.19,63,1014,96,46.74,2022,1,25,1,1,4,Winter,5.4,1.46,Cold,43.681226,12.12,Calm,48.69702059,Moderate,1,0.12,Very Humid,Dry,Low,80.50591164,1.6034,72.36885949,0.159908759,-23.02885949,4095.22,0.7172
Apopka,26/01/2022,54.62,48.81,59.36,58.78,57.69,60.13,53.73,97,0.4,0.17,34.83,7.09,0.58,18.72,37,1015,96,54.11,2022,1,26,2,1,4,Winter,10.55,2.44,Mild,49.696862,18.14,Light,54.62,Moderate,1,0.68,Very Humid,Comfortable,Low,73.44240138,1.8526,72.36885949,0.159908759,-17.74885949,5298.14,2.836
Apopka,27/01/2022,59.51,54.82,65.19,60.94,59.63,62.69,56.53,90,0,0,71.06,8.71,0.05,23.85,20,1017,96,57.71,2022,1,27,3,1,4,Winter,10.37,3.06,Mild,56.39447,23.8,Light,59.51,No Rain,0,0,Very Humid,Comfortable,Low,76.67778842,0.8729,72.36885949,0.159908759,-12.85885949,5355.9,0
Apopka,28/01/2022,56.78,51.31,67.01,61.91,59.97,64.53,52.34,86,0.02,0.01,117.95,7.19,0.56,22.53,308,1012,96,54.22,2022,1,28,4,1,4,Winter,15.7,4.56,Mild,53.028164,21.97,Light,56.78,Light,1,0.04,Very Humid,Comfortable,Low,82.02324362,0.9886,72.36885949,0.159908759,-15.58885949,4883.08,0.1438
Apopka,29/01/2022,43.23,35.46,53.74,59.09,56.57,61.75,24.3,48,0,0,210.2,11.83,0.16,32.7,316,1017,96,35.99,2022,1,29,5,1,4,Winter,18.28,5.18,Cold,38.989632,32.54,Moderate,36.96560714,No Rain,0,0,Comfortable,Dry,Moderate,43.16686572,1.8117,72.36885949,0.159908759,-29.13885949,2075.04,0
Apopka,30/01/2022,42.41,29.67,54.19,55.97,51.96,59.97,20.42,43,0,0,209.94,4.39,0.16,13.09,311,1022,96,34.48,2022,1,30,6,1,4,Winter,24.52,8.01,Cold,38.494979,12.93,Calm,39.77271314,No Rain,0,0,Comfortable,Dry,Moderate,56.2238413,1.5551,72.36885949,0.159908759,-29.95885949,1823.63,0
Apopka,31/01/2022,50.64,33.86,67.35,57.43,52.95,62.51,38.72,66,0,0,204.81,3.12,0.02,11.9,211,1020,96,44.9,2022,1,31,0,1,5,Winter,33.49,9.56,Mild,46.423392,11.88,Calm,50.64,No Rain,0,0,Humid,Dry,Moderate,73.44129242,1.0928,72.36885949,0.159908759,-21.72885949,3342.24,0
Apopka,01/02/2022,55.77,39.21,70.63,59.28,55.31,63.27,44.17,69,0,0,179.05,4.74,0.09,20.2,85,1020,96,49.69,2022,2,1,1,1,5,Winter,31.42,7.96,Mild,52.529829,20.11,Calm,55.77,No Rain,0,0,Humid,Dry,Low,83.10687171,0.9011,72.36885949,0.159908759,-16.59885949,3848.13,0
Apopka,02/02/2022,63.8,49.21,78.04,61.72,57.81,66.11,52.24,70,0,0,190.46,6.91,0.69,25.93,107,1018,96,57.02,2022,2,2,2,1,5,Winter,28.83,8.3,Mild,62.3678,25.24,Light,63.8,No Rain,0,0,Humid,Comfortable,Low,84.38203517,0.5864,72.36885949,0.159908759,-8.568859489,4466,0
Apopka,03/02/2022,70.32,61.39,81.18,65.39,61.93,69.48,60,72,0,0,187.96,7.43,0.13,23.38,133,1017,96,63.72,2022,2,3,3,1,5,Winter,19.79,7.55,Warm,70.396032,23.25,Light,70.32,No Rain,0,0,Humid,Comfortable,Low,87.68394436,0.3132,72.36885949,0.159908759,-2.048859489,5063.04,0
Apopka,04/02/2022,71.65,62.78,82.69,68.32,64.98,72.39,64.71,80,0,0,179.16,5.24,0.27,20.56,193,1017,96,67.02,2022,2,4,4,1,5,Winter,19.91,7.41,Warm,72.0856,20.29,Light,71.65,No Rain,0,0,Humid,Sticky,Low,98.38521285,0.2921,72.36885949,0.159908759,-0.718859489,5732,0
Apopka,05/02/2022,57.97,49.89,69.12,67,63.73,69.75,54.95,90,0.05,0.02,41.05,6.93,0.13,19.77,13,1019,96,56.18,2022,2,5,5,1,5,Winter,19.23,6.02,Mild,54.39709,19.64,Light,57.97,Light,1,0.08,Very Humid,Comfortable,Low,80.71499444,0.9787,72.36885949,0.159908759,-14.39885949,5217.3,0.3465
Apopka,06/02/2022,56.03,50.74,63.01,63.56,62.2,65.23,55.02,97,0.04,0.01,65.03,5.5,0.22,14.99,359,1018,96,55.43,2022,2,6,6,1,5,Winter,12.27,3.03,Mild,51.558203,14.77,Light,56.03,Light,1,0.04,Very Humid,Comfortable,Low,78.72449236,0.9985,72.36885949,0.159908759,-16.33885949,5434.91,0.22
Apopka,07/02/2022,52.77,49.08,60.01,62.84,61.57,64.6,51.06,94,0,0,100.12,5.2,0.22,16.73,322,1017,96,51.81,2022,2,7,0,1,6,Winter,10.93,3.03,Mild,47.425254,16.51,Light,52.77,No Rain,0,0,Very Humid,Comfortable,Low,79.66174123,1.0695,72.36885949,0.159908759,-19.59885949,4960.38,0
Apopka,08/02/2022,50.04,47.35,52.39,60.77,59.22,62.4,48.92,96,0.43,0.03,20.59,5.09,0.45,11.97,17,1016,96,49.44,2022,2,8,1,1,6,Winter,5.04,3.18,Mild,43.716672,11.52,Light,50.04,Moderate,1,0.12,Very Humid,Dry,Low,76.95153117,2.0616,72.36885949,0.159908759,-22.32885949,4803.84,2.1887
Apopka,09/02/2022,53.2,43.57,64.74,60.56,57.9,64.31,44.41,76,0.01,0.01,219.15,5.37,0.25,16.13,352,1015,96,48.62,2022,2,9,2,1,6,Winter,21.17,6.41,Mild,48.98656,15.88,Light,53.2,Light,1,0.04,Humid,Dry,Moderate,86.42327481,1.0748,72.36885949,0.159908759,-19.16885949,4043.2,0.0537
Apopka,10/02/2022,53.91,40.14,69.04,60.38,55.89,65.39,42.87,71,0,0,225.06,3.78,0.02,16.96,40,1016,96,48.25,2022,2,10,3,1,6,Winter,28.9,9.5,Mild,50.140113,16.94,Calm,53.91,No Rain,0,0,Humid,Dry,Moderate,80.68545564,0.9557,72.36885949,0.159908759,-18.45885949,3827.61,0
Apopka,11/02/2022,60.86,47.97,76.28,62.54,58.44,67.3,50.63,71,0,0,177.86,4.31,0.02,14.88,72,1015,96,55.01,2022,2,11,4,1,6,Winter,28.31,8.86,Mild,58.718498,14.86,Calm,60.86,No Rain,0,0,Humid,Comfortable,Low,86.3445088,0.6294,72.36885949,0.159908759,-11.50885949,4321.06,0
Apopka,12/02/2022,65.25,51.55,80.89,65.62,61.3,70.5,54.04,72,0,0,199.2,2.7,0.02,8.88,5,1015,96,58.53,2022,2,12,5,1,6,Winter,29.34,9.2,Mild,64.1214,8.86,Calm,65.25,No Rain,0,0,Humid,Comfortable,Low,85.18321095,0.3455,72.36885949,0.159908759,-7.118859489,4698,0
Apopka,13/02/2022,63.42,54.52,72.09,66.92,65.26,69.12,58.28,84,0.14,0.03,126.98,6.14,0.05,26.46,282,1014,96,60.23,2022,2,13,6,1,6,Winter,17.57,3.86,Mild,61.596024,26.41,Light,63.42,Moderate,1,0.12,Very Humid,Comfortable,Low,90.32045196,0.8546,72.36885949,0.159908759,-8.948859489,5327.28,0.8596
Apopka,14/02/2022,50.64,40.58,62.15,62.94,58.95,66.72,27.6,43,0,0,225.38,6.61,0.09,19.91,5,1023,96,41,2022,2,14,0,1,7,Winter,21.57,7.77,Mild,47.892816,19.82,Light,50.64,No Rain,0,0,Comfortable,Dry,Moderate,58.74460423,1.2324,72.36885949,0.159908759,-21.72885949,2177.52,0
Apopka,15/02/2022,56.03,39.03,69.93,61.66,58.17,65.17,46.18,71,0,0,141.49,6.81,1.05,25.3,58,1026,96,50.74,2022,2,15,1,1,7,Winter,30.9,7,Mild,52.756829,24.25,Light,56.03,No Rain,0,0,Humid,Dry,Low,80.67377033,0.9709,72.36885949,0.159908759,-16.33885949,3978.13,0
Apopka,16/02/2022,65.6,53.28,78.39,64.69,60.91,69.04,57.19,77,0,0,194.97,7.4,0.72,24.65,93,1025,96,60.4,2022,2,16,2,1,7,Winter,25.11,8.13,Mild,64.48196,23.93,Light,65.6,No Rain,0,0,Humid,Comfortable,Low,88.90957596,0.516,72.36885949,0.159908759,-6.768859489,5051.2,0
Apopka,17/02/2022,72.52,61.7,84.85,68.16,64.94,72.27,65.39,81,0,0,169.24,6.44,0.31,20.65,130,1019,96,67.72,2022,2,17,3,1,7,Winter,23.15,7.33,Warm,73.193596,20.34,Light,72.52,No Rain,0,0,Very Humid,Uncomfortable,Low,93.82823468,0.3836,72.36885949,0.159908759,0.151140511,5874.12,0
Apopka,18/02/2022,73.48,68.9,81.75,71.3,68.85,74.71,68.2,84,0,0,145.56,5.22,0.47,15.66,237,1016,96,69.84,2022,2,18,4,1,7,Winter,12.85,5.86,Warm,74.444656,15.19,Light,73.48,No Rain,0,0,Very Humid,Uncomfortable,Low,94.59087868,0.3828,72.36885949,0.159908759,1.111140511,6172.32,0
Apopka,19/02/2022,66.36,50.43,73.22,71.77,70.18,74.52,55.33,71,0,0,154.01,6.09,0.34,18.36,342,1018,96,59.65,2022,2,19,5,1,7,Winter,22.79,4.34,Mild,65.507148,18.02,Light,66.36,No Rain,0,0,Humid,Comfortable,Low,88.89605497,0.4256,72.36885949,0.159908759,-6.008859489,4711.56,0
Apopka,20/02/2022,61.61,47.07,76.12,69.28,65.05,73.74,48.99,65,0,0,235.37,7.35,1.3,21.7,69,1022,96,54.5,2022,2,20,6,1,7,Winter,29.05,8.69,Mild,59.810345,20.4,Light,61.61,No Rain,0,0,Humid,Dry,Moderate,78.40108494,0.7135,72.36885949,0.159908759,-10.75885949,4004.65,0
Apopka,21/02/2022,67.42,56.5,79.32,70.29,66.79,74.1,57.01,72,0,0,189.07,5.8,0.58,19.57,99,1021,96,60.98,2022,2,21,0,1,8,Winter,22.82,7.31,Mild,66.806992,18.99,Light,67.42,No Rain,0,0,Humid,Comfortable,Low,91.02973165,0.361,72.36885949,0.159908759,-4.948859489,4854.24,0
Apopka,22/02/2022,70.87,60.08,82.83,71.88,68.05,76.32,61.5,75,0,0,215.76,6.36,0.36,17.34,115,1021,96,64.79,2022,2,22,1,1,8,Winter,22.75,8.27,Warm,71.085325,16.98,Light,70.87,No Rain,0,0,Humid,Sticky,Moderate,92.39872862,0.2979,72.36885949,0.159908759,-1.498859489,5315.25,0
Apopka,23/02/2022,72.68,64.2,84.15,74.03,70.36,78.57,65.74,81,0,0,215.22,4.37,0.09,13.73,144,1020,96,68,2022,2,23,2,1,8,Winter,19.95,8.21,Warm,73.396364,13.64,Calm,72.68,No Rain,0,0,Very Humid,Uncomfortable,Moderate,95.63253937,0.3088,72.36885949,0.159908759,0.311140511,5887.08,0
Apopka,24/02/2022,71.52,60.87,83.82,74.92,71.02,78.84,63.63,79,0,0,217.02,3.85,0.05,13.62,126,1020,96,66.3,2022,2,24,3,1,8,Winter,22.95,7.82,Warm,71.916264,13.57,Calm,71.52,No Rain,0,0,Humid,Sticky,Moderate,94.98428501,0.23,72.36885949,0.159908759,-0.848859489,5650.08,0
Apopka,25/02/2022,73.23,62.44,84.76,75.45,71.98,79.39,64.94,78,0,0,202.16,3.09,0.05,16.8,176,1021,96,67.67,2022,2,25,4,1,8,Winter,22.32,7.41,Warm,74.061402,16.75,Calm,73.23,No Rain,0,0,Humid,Sticky,Moderate,91.14893829,0.2851,72.36885949,0.159908759,0.861140511,5711.94,0
Apopka,26/02/2022,72.08,60.91,84.58,76.21,72.23,80.64,64.12,78,0,0,236.78,4.24,0,15.99,148,1021,96,66.78,2022,2,26,5,1,8,Winter,23.67,8.41,Warm,72.615392,15.99,Calm,72.08,No Rain,0,0,Humid,Sticky,Moderate,95.04763983,0.2736,72.36885949,0.159908759,-0.288859489,5622.24,0
Apopka,27/02/2022,71.26,58.73,82.89,76.76,72.81,81.09,62.28,76,0,0,238.24,3.89,0,14.88,267,1017,96,65.38,2022,2,27,6,1,8,Winter,24.16,8.28,Warm,71.576008,14.88,Calm,71.26,No Rain,0,0,Humid,Sticky,Moderate,93.19035783,0.2186,72.36885949,0.159908759,-1.108859489,5415.76,0
Apopka,28/02/2022,64.19,57.63,72.27,75.2,73.35,77.9,60.39,88,0.05,0.03,106.1,4.63,0.02,21.21,340,1014,96,61.78,2022,2,28,0,1,9,Winter,14.64,4.55,Mild,62.502776,21.19,Calm,64.19,Light,1,0.12,Very Humid,Sticky,Low,89.82351881,0.5757,72.36885949,0.159908759,-8.178859489,5648.72,0.2315
Apopka,01/03/2022,62.33,57.09,73.02,72.65,70.43,75.65,53.88,76,0,0,194.74,5.99,0.29,21.07,26,1015,96,57.31,2022,3,1,1,1,9,Spring,15.93,5.22,Mild,60.406364,20.78,Light,62.33,No Rain,0,0,Humid,Comfortable,Low,90.18694835,0.6231,72.36885949,0.159908759,-10.03885949,4737.08,0
Apopka,02/03/2022,63.23,49.21,76.33,72.08,67.69,76.84,50.94,67,0,0,254.68,4.91,0.07,14.54,17,1017,96,56.13,2022,3,2,2,1,9,Spring,27.12,9.15,Mild,61.733153,14.47,Calm,63.23,No Rain,0,0,Humid,Comfortable,Moderate,86.69426167,0.5349,72.36885949,0.159908759,-9.138859489,4236.41,0
Apopka,03/03/2022,66.75,52.72,81.54,73.43,69.06,78.42,53.11,66,0,0,247.95,3.04,0.05,12.39,44,1018,96,58.62,2022,3,3,3,1,9,Spring,28.82,9.36,Mild,66.04215,12.34,Calm,66.75,No Rain,0,0,Humid,Comfortable,Moderate,82.90995284,0.2841,72.36885949,0.159908759,-5.618859489,4405.5,0
Apopka,04/03/2022,69.72,56.1,83.59,74.69,70.7,78.93,50.81,56,0,0,252.54,5.01,0.02,18.77,77,1021,96,58.61,2022,3,4,4,1,9,Spring,27.49,8.23,Mild,69.668256,18.75,Light,69.72,No Rain,0,0,Comfortable,Comfortable,Moderate,83.31724363,0.2144,72.36885949,0.159908759,-2.648859489,3904.32,0
Apopka,05/03/2022,69.31,55.89,83.25,74.62,71.24,78.1,58.77,73,0,0,221.95,6.67,0.36,23.85,95,1023,96,62.65,2022,3,5,5,1,9,Spring,27.36,6.86,Mild,69.143779,23.49,Light,69.31,No Rain,0,0,Humid,Comfortable,Moderate,90.4279854,0.3013,72.36885949,0.159908759,-3.058859489,5059.63,0
Apopka,06/03/2022,72.38,60.55,85.75,75.42,71.73,79.66,60.35,70,0,0,256.43,7.31,0.72,24.67,105,1022,96,64.62,2022,3,6,6,1,9,Spring,25.2,7.93,Warm,72.92978,23.95,Light,72.38,No Rain,0,0,Humid,Sticky,Moderate,85.40469084,0.4114,72.36885949,0.159908759,0.011140511,5066.6,0
Apopka,07/03/2022,74.66,65.53,86.97,76.9,73.6,80.83,66.33,78,0.71,0.25,214.58,6.31,0.31,20.92,148,1017,96,69,2022,3,7,0,1,10,Spring,21.44,7.23,Warm,75.859484,20.61,Light,74.66,Heavy,1,1,Humid,Uncomfortable,Moderate,92.31998619,1.9054,72.36885949,0.159908759,2.291140511,5823.48,4.4801
Apopka,08/03/2022,74.65,69.73,86.76,77.41,74.84,80.58,70.22,88,0.14,0.14,173.29,4.06,0.07,18.63,174,1014,96,71.55,2022,3,8,1,1,10,Spring,17.03,5.74,Warm,76.00036,18.56,Calm,74.65,Moderate,1,0.56,Very Humid,Oppressive,Low,88.77186523,0.6749,72.36885949,0.159908759,2.281140511,6569.2,0.5684
Apopka,09/03/2022,74.34,68.63,84.74,76.85,74.71,79.75,70.24,88,0.12,0.06,151.92,5.5,0.13,17.31,171,1012,96,71.47,2022,3,9,2,1,10,Spring,16.11,5.04,Warm,75.600336,17.18,Light,74.34,Moderate,1,0.24,Very Humid,Oppressive,Low,90.54352162,0.677,72.36885949,0.159908759,1.971140511,6541.92,0.66
Apopka,10/03/2022,69.09,64.18,79.74,74.48,72.82,76.66,66.84,93,1.66,0.41,102.04,4.84,0.02,20.85,90,1013,96,67.56,2022,3,10,3,1,10,Spring,15.56,3.84,Mild,68.810721,20.83,Calm,69.09,Very Heavy,1,1.64,Very Humid,Uncomfortable,Low,89.92047473,3.5591,72.36885949,0.159908759,-3.278859489,6425.37,8.0344
Apopka,11/03/2022,73.86,65.48,84.78,74.11,71.46,77.11,68.96,86,0,0,129.31,4.63,0.05,16.28,153,1011,96,70.47,2022,3,11,4,1,10,Spring,19.3,5.65,Warm,74.955468,16.23,Calm,73.86,No Rain,0,0,Very Humid,Uncomfortable,Low,92.21120725,0.3782,72.36885949,0.159908759,1.491140511,6351.96,0
Apopka,12/03/2022,64.47,42.96,75.51,71.94,66.43,74.82,54.02,72,0.58,0.31,84.46,11.63,0.47,38.47,262,1010,96,58.22,2022,3,12,5,1,10,Spring,32.55,8.39,Mild,63.156072,38,Moderate,64.47,Heavy,1,1.24,Humid,Comfortable,Low,72.99761266,1.9017,72.36885949,0.159908759,-7.898859489,4641.84,6.7454
Apopka,13/03/2022,49.33,35.1,62.98,66.02,60.85,71.53,36.48,62,0,0,277.29,7.81,0.36,21.72,19,1024,93,43.35,2022,3,13,6,1,10,Spring,27.88,10.68,Cold,45.100918,21.36,Light,46.02815788,No Rain,0,0,Humid,Dry,Moderate,67.66882812,1.3459,72.36885949,0.159908759,-23.03885949,3058.46,0
Apopka,14/03/2022,61.95,47.97,74.88,68.32,64.18,73.11,52.54,74,0,0,218.78,7.99,0.83,24.09,65,1023,95,56.45,2022,3,14,0,1,11,Spring,26.91,8.93,Mild,59.98419,23.26,Light,61.95,No Rain,0,0,Humid,Comfortable,Moderate,83.00659636,0.7221,72.36885949,0.159908759,-10.41885949,4584.3,0
Apopka,15/03/2022,69.99,63.88,78.87,71.31,68.67,74.7,62.98,79,0.08,0.04,138.64,8.07,0.09,27.22,94,1018,96,65.39,2022,3,15,1,1,11,Spring,14.99,6.03,Mild,69.987393,27.13,Light,69.99,Light,1,0.16,Humid,Sticky,Low,90.90884926,0.4833,72.36885949,0.159908759,-2.378859489,5529.21,0.6456
Apopka,16/03/2022,69.39,62.89,81.19,72.74,69.98,76.44,66.63,92,0.95,0.3,161.63,4.2,0,30.74,224,1013,96,67.53,2022,3,16,2,1,11,Spring,18.3,6.46,Mild,69.204804,30.74,Calm,69.39,Heavy,1,1.2,Very Humid,Uncomfortable,Low,89.00356012,2.0985,72.36885949,0.159908759,-2.978859489,6383.88,3.99
Apopka,17/03/2022,69.4,62.76,79.29,73.9,69.76,79.43,61.56,79,0,0,280.98,4.59,0.07,12.39,268,1013,96,64.32,2022,3,17,3,1,11,Spring,16.53,9.67,Mild,69.24358,12.32,Calm,69.4,No Rain,0,0,Humid,Sticky,Moderate,97.76132089,0.2136,72.36885949,0.159908759,-2.968859489,5482.6,0
Apopka,18/03/2022,73.24,56.5,89.06,75.29,70.05,81.12,62.88,74,0,0,247.36,4.73,0.02,20.76,127,1014,96,66.41,2022,3,18,4,1,11,Spring,32.56,11.07,Warm,74.031208,20.74,Calm,73.24,No Rain,0,0,Humid,Sticky,Moderate,92.96700767,0.3512,72.36885949,0.159908759,0.871140511,5419.76,0
Apopka,19/03/2022,75.02,65.35,86.77,78.29,73.8,83.66,66.97,77,0,0,254.35,6.52,0.05,23.6,195,1015,96,69.52,2022,3,19,5,1,11,Spring,21.42,9.86,Warm,76.295582,23.55,Light,75.02,No Rain,0,0,Humid,Uncomfortable,Moderate,90.8305144,0.5118,72.36885949,0.159908759,2.651140511,5776.54,0
Apopka,20/03/2022,69.44,57.83,76.78,79.16,75.7,83.39,55.93,66,0,0,259.45,6.75,0.25,24.43,332,1018,96,61.12,2022,3,20,6,1,11,Spring,18.95,7.69,Mild,69.318032,24.18,Light,69.44,No Rain,0,0,Humid,Comfortable,Moderate,85.47204015,0.298,72.36885949,0.159908759,-2.928859489,4583.04,0
Apopka,21/03/2022,64.79,49.96,78.33,76.41,71.73,81,51.84,65,0,0,283.51,6.71,0.69,22.03,72,1019,96,57.21,2022,3,21,0,1,12,Spring,28.37,9.27,Mild,63.672455,21.34,Light,64.79,No Rain,0,0,Humid,Comfortable,Moderate,82.09885647,0.5289,72.36885949,0.159908759,-7.578859489,4211.35,0
Apopka,22/03/2022,70,57.83,82.8,76.78,72.39,81.64,58.64,70,0,0,266.88,6.54,0.29,21.94,108,1016,96,62.82,2022,3,22,1,1,12,Spring,24.97,9.25,Mild,70,21.65,Light,70,No Rain,0,0,Humid,Comfortable,Moderate,88.98369885,0.2616,72.36885949,0.159908759,-2.368859489,4900,0
Apopka,23/03/2022,75.15,68.86,84.49,77.79,75.49,80.24,68.25,80,0.04,0.02,151.77,6.97,0.22,29.26,145,1012,96,70.38,2022,3,23,2,1,12,Spring,15.63,4.75,Warm,76.5096,29.04,Light,75.15,Light,1,0.08,Humid,Uncomfortable,Low,91.4553809,0.6163,72.36885949,0.159908759,2.781140511,6012,0.2788
Apopka,24/03/2022,70.64,62.28,74.46,76.01,74.1,77.83,68.36,93,0.39,0.14,47.15,5.11,0.13,18.68,234,1010,96,69.07,2022,3,24,3,1,12,Spring,12.18,3.73,Warm,70.836416,18.55,Light,70.64,Moderate,1,0.56,Very Humid,Uncomfortable,Low,90.42050361,1.0164,72.36885949,0.159908759,-1.728859489,6569.52,1.9929
Apopka,25/03/2022,66.25,60.37,74.44,74.15,70.61,78.64,53.45,66,0,0,286.75,8.7,0.09,24.07,293,1012,96,58.61,2022,3,25,4,1,12,Spring,14.07,8.03,Mild,65.43325,23.98,Light,66.25,No Rain,0,0,Humid,Comfortable,Moderate,78.11521667,0.5355,72.36885949,0.159908759,-6.118859489,4372.5,0
Apopka,26/03/2022,65.79,56.07,76.26,74.68,70.21,79.93,49.78,59,0,0,295.81,9.17,0.4,25.81,289,1013,96,56.59,2022,3,26,5,1,12,Spring,20.19,9.72,Mild,64.970313,25.41,Light,65.79,No Rain,0,0,Comfortable,Dry,Moderate,71.71678345,0.5773,72.36885949,0.159908759,-6.578859489,3881.61,0
Apopka,27/03/2022,66.82,56.59,77.52,75.47,71.06,80.62,47.49,55,0,0,295.4,7.83,0.87,21.32,291,1015,96,55.92,2022,3,27,6,1,12,Spring,20.93,9.56,Mild,66.24283,20.45,Light,66.82,No Rain,0,0,Comfortable,Dry,Moderate,73.3239418,0.4722,72.36885949,0.159908759,-5.548859489,3675.1,0
Apopka,28/03/2022,70.23,62.51,81.59,77.14,72.72,82.76,58.89,70,0,0,287.73,6.94,0.38,19.26,271,1017,96,63.04,2022,3,28,0,1,13,Spring,19.08,10.04,Warm,70.28313,18.88,Light,70.23,No Rain,0,0,Humid,Comfortable,Moderate,87.72990043,0.2891,72.36885949,0.159908759,-2.138859489,4916.1,0
Apopka,29/03/2022,70.2,61.9,82.09,78.54,73.96,83.84,60.62,75,0,0,292.2,5.38,0.16,14.25,264,1018,96,64.03,2022,3,29,1,1,13,Spring,20.19,9.88,Warm,70.2495,14.09,Light,70.2,No Rain,0,0,Humid,Sticky,Moderate,95.53460494,0.2252,72.36885949,0.159908759,-2.168859489,5265,0
Apopka,30/03/2022,73.75,62.76,85.08,79.15,75.2,83.52,62.45,71,0,0,280.95,8.27,0.74,25.03,136,1015,96,66.31,2022,3,30,2,1,13,Spring,22.32,8.32,Warm,74.628625,24.29,Light,73.75,No Rain,0,0,Humid,Sticky,Moderate,82.59076261,0.5183,72.36885949,0.159908759,1.381140511,5236.25,0
Apopka,31/03/2022,74.55,67.03,84.45,78.93,77.02,80.73,66.74,78,0.1,0.04,115.33,8.71,0.2,25.25,178,1010,96,69.23,2022,3,31,3,1,13,Spring,17.42,3.71,Warm,75.72117,25.05,Light,74.55,Light,1,0.16,Humid,Uncomfortable,Low,85.693577,0.7759,72.36885949,0.159908759,2.181140511,5814.9,0.871
Apopka,01/04/2022,73.2,67.32,80.31,76.35,73.47,79.56,67.92,85,2.69,0.36,163.36,3.89,0.02,17.11,278,1012,96,69.57,2022,4,1,4,2,13,Spring,12.99,6.09,Warm,74.0976,17.09,Calm,73.2,Very Heavy,1,1.44,Very Humid,Uncomfortable,Low,91.23201027,5.6956,72.36885949,0.159908759,0.831140511,6222,10.4641
Apopka,02/04/2022,68.89,61.65,78.44,75.16,71.65,78.15,67.4,95,2.25,0.81,71.34,4.17,0.05,36.37,161,1012,96,67.88,2022,4,2,5,2,13,Spring,16.79,6.5,Mild,68.542015,36.32,Calm,68.89,Very Heavy,1,3.24,Very Humid,Uncomfortable,Low,86.55721793,4.7223,72.36885949,0.159908759,-3.478859489,6544.55,9.3825
Apopka,03/04/2022,68.2,61.3,78.3,74.18,70.2,80.31,61.27,81,0,0,265.98,4.58,0.02,14.65,335,1011,96,63.73,2022,4,3,6,2,13,Spring,17,10.11,Mild,67.71886,14.63,Calm,68.2,No Rain,0,0,Very Humid,Sticky,Moderate,96.90756547,0.2732,72.36885949,0.159908759,-4.168859489,5524.2,0
Apopka,04/04/2022,69.95,56.41,82.45,76.31,71.35,82.09,59.77,73,0,0,280.29,5.05,0.05,17.09,112,1012,96,63.45,2022,4,4,0,2,14,Spring,26.04,10.74,Mild,69.937955,17.04,Light,69.95,No Rain,0,0,Humid,Comfortable,Moderate,95.15131506,0.2045,72.36885949,0.159908759,-2.418859489,5106.35,0
Apopka,05/04/2022,76.4,65.75,87.8,78.87,74.93,83.91,68.62,79,0.01,0.01,243.95,6.29,0.45,25.39,175,1010,96,71,2022,4,5,1,2,14,Spring,22.05,8.98,Warm,78.06848,24.94,Light,76.4,Light,1,0.04,Humid,Uncomfortable,Moderate,92.01627217,0.5916,72.36885949,0.159908759,4.031140511,6035.6,0.0629
Apopka,06/04/2022,79.08,72.3,87.82,80.38,76.96,84.78,72.17,80,0,0,220.91,5.77,0.18,18.99,215,1009,96,74.15,2022,4,6,2,2,14,Spring,15.52,7.82,Warm,81.47712,18.81,Light,79.08,No Rain,0,0,Humid,Oppressive,Moderate,92.43739257,0.6848,72.36885949,0.159908759,6.711140511,6326.4,0
Apopka,07/04/2022,74.02,66.69,79.7,79,76.64,82.24,70.8,90,0.71,0.3,68.54,8.38,0.51,39.79,217,1007,96,71.75,2022,4,7,3,2,14,Spring,13.01,5.6,Warm,75.21394,39.28,Light,74.02,Heavy,1,1.2,Very Humid,Oppressive,Low,81.33034052,1.9562,72.36885949,0.159908759,1.651140511,6661.8,5.9498
Apopka,08/04/2022,66.12,60.3,71.19,75.35,71.47,79.56,49.03,56,0,0,315.71,11.91,1.61,28.32,284,1011,96,56.36,2022,4,8,4,2,14,Spring,10.89,8.09,Mild,65.402976,26.71,Moderate,66.12,No Rain,0,0,Comfortable,Dry,Moderate,62.21272386,0.6704,72.36885949,0.159908759,-6.248859489,3702.72,0
Apopka,09/04/2022,61.76,53.89,67.73,75.22,71.64,79.16,43.41,52,0,0,298.78,10.12,0.38,35.39,290,1014,96,52.02,2022,4,9,5,2,14,Spring,13.84,7.52,Mild,60.346016,35.01,Moderate,61.76,No Rain,0,0,Comfortable,Dry,Moderate,61.83212774,0.8168,72.36885949,0.159908759,-10.60885949,3211.52,0
Apopka,10/04/2022,60.05,43.61,72.86,74.5,69.21,80.53,41.72,56,0,0,324.38,4.26,0.02,16.84,4,1018,96,50.56,2022,4,10,6,2,14,Spring,29.25,11.32,Mild,58.21124,16.82,Calm,60.05,No Rain,0,0,Comfortable,Dry,Moderate,75.40835648,0.6679,72.36885949,0.159908759,-12.31885949,3362.8,0
Apopka,11/04/2022,66.5,51.06,80.46,75.91,70.83,81.59,51.52,61,0,0,316.2,5.83,0.16,23.11,114,1018,96,57.72,2022,4,11,0,2,15,Spring,29.4,10.76,Mild,65.79545,22.95,Light,66.5,No Rain,0,0,Humid,Comfortable,Moderate,82.83235612,0.4082,72.36885949,0.159908759,-5.868859489,4056.5,0
Apopka,12/04/2022,71.75,60.98,83.35,78.29,73.76,83.82,59.38,67,0,0,309.07,6.41,0.2,17.36,127,1018,96,63.85,2022,4,12,1,2,15,Spring,22.37,10.06,Warm,72.136925,17.16,Light,71.75,No Rain,0,0,Humid,Comfortable,Moderate,86.23153127,0.3439,72.36885949,0.159908759,-0.618859489,4807.25,0
Apopka,13/04/2022,73.37,63.23,83.55,79.3,75.85,82.9,62.58,71,0,0,227.24,6.49,0.34,21.68,125,1016,96,66.27,2022,4,13,2,2,15,Spring,20.32,7.05,Warm,74.159591,21.34,Light,73.37,No Rain,0,0,Humid,Sticky,Moderate,87.78303712,0.4281,72.36885949,0.159908759,1.001140511,5209.27,0
Apopka,14/04/2022,74.7,66.24,83.95,79.71,77.05,82.96,67.59,80,0.69,0.59,186.91,4.05,0.07,29.53,174,1014,96,69.82,2022,4,14,3,2,15,Spring,17.71,5.91,Warm,75.9408,29.46,Calm,74.7,Heavy,1,2.36,Humid,Uncomfortable,Low,94.21226166,1.777,72.36885949,0.159908759,2.331140511,5976,2.7945
Apopka,15/04/2022,73.4,68.02,84.6,79.06,76.6,81.7,69.62,89,0.01,0.01,198.81,5.01,0.05,25.28,73,1014,96,70.76,2022,4,15,4,2,15,Spring,16.58,5.1,Warm,74.39858,25.23,Light,73.4,Light,1,0.04,Very Humid,Uncomfortable,Low,91.48571591,0.3904,72.36885949,0.159908759,1.031140511,6532.6,0.0501
Apopka,16/04/2022,74.84,63.95,86.45,80.11,75.36,86.29,67.11,79,0,0,312.11,4.78,0.13,18.99,134,1014,96,69.55,2022,4,16,5,2,15,Spring,22.5,10.93,Warm,76.101788,18.86,Calm,74.84,No Rain,0,0,Humid,Uncomfortable,Moderate,95.58035576,0.4332,72.36885949,0.159908759,2.471140511,5912.36,0
Apopka,17/04/2022,76.06,65.28,86.61,82.26,78.58,87.22,68.39,79,1.45,0.93,248.63,4.19,0,31.83,182,1012,96,70.75,2022,4,17,6,2,15,Spring,21.33,8.64,Warm,77.639842,31.83,Calm,76.06,Very Heavy,1,3.72,Humid,Uncomfortable,Moderate,93.20114551,3.3706,72.36885949,0.159908759,3.691140511,6008.74,6.0755
Apopka,18/04/2022,75.62,68.11,83.62,79.87,77.23,83.16,68.27,80,0,0,210.73,5.63,0.16,17.98,247,1011,96,70.54,2022,4,18,0,2,16,Spring,15.51,5.93,Warm,77.10368,17.82,Light,75.62,No Rain,0,0,Humid,Uncomfortable,Moderate,94.90932304,0.5062,72.36885949,0.159908759,3.251140511,6049.6,0
Apopka,19/04/2022,69.29,59.45,77.59,80.42,76.35,85.55,55.54,65,0,0,325.86,7.1,0.16,22.41,21,1015,96,60.85,2022,4,19,1,2,16,Spring,18.14,9.2,Mild,69.137705,22.25,Light,69.29,No Rain,0,0,Humid,Comfortable,Moderate,83.71850319,0.3195,72.36885949,0.159908759,-3.078859489,4503.85,0
Apopka,20/04/2022,66.85,55.29,77.58,78.93,75.07,82.58,53.85,64,0.01,0.01,266.44,8.06,1.03,26.17,69,1021,96,59.05,2022,4,20,2,2,16,Spring,22.29,7.51,Mild,66.18472,25.14,Light,66.85,Light,1,0.04,Humid,Comfortable,Moderate,78.88627438,0.4999,72.36885949,0.159908759,-5.518859489,4278.4,0.0806
Apopka,21/04/2022,70.47,60.98,79,79.12,75.96,82.85,58.03,65,0,0,228.22,7.57,0.47,25.52,66,1022,96,62.64,2022,4,21,3,2,16,Spring,18.02,6.89,Warm,70.570815,25.05,Light,70.47,No Rain,0,0,Humid,Comfortable,Moderate,82.392237,0.3263,72.36885949,0.159908759,-1.898859489,4580.55,0
Apopka,22/04/2022,70.07,60.44,79.38,79.29,75.9,83.21,59.29,70,0,0,246.11,7.7,1.3,28.45,56,1022,96,63.22,2022,4,22,4,2,16,Spring,18.94,7.31,Warm,70.08617,27.15,Light,70.07,No Rain,0,0,Humid,Comfortable,Moderate,85.70683756,0.3115,72.36885949,0.159908759,-2.298859489,4904.9,0
Apopka,23/04/2022,71.23,60.57,80.82,79.82,76.5,83.52,61.03,72,0,0,261.57,7.47,0.25,22.08,71,1019,96,64.63,2022,4,23,5,2,16,Spring,20.25,7.02,Warm,71.522248,21.83,Light,71.23,No Rain,0,0,Humid,Sticky,Moderate,87.02494693,0.3603,72.36885949,0.159908759,-1.138859489,5128.56,0
Apopka,24/04/2022,73.13,63.14,82.67,80.6,77.11,84.6,63.97,75,0,0,259.19,6.62,0.38,22.75,85,1017,96,67.03,2022,4,24,6,2,16,Spring,19.53,7.49,Warm,73.904675,22.37,Light,73.13,No Rain,0,0,Humid,Sticky,Moderate,90.31408671,0.4213,72.36885949,0.159908759,0.761140511,5484.75,0
Apopka,25/04/2022,74.62,65.1,86.27,81.5,78.03,85.41,64,72,0,0,250.32,5.39,0.05,18.7,97,1017,96,67.53,2022,4,25,0,2,17,Spring,21.17,7.38,Warm,75.717712,18.65,Light,74.62,No Rain,0,0,Humid,Sticky,Moderate,90.78576945,0.4466,72.36885949,0.159908759,2.251140511,5372.64,0
Apopka,26/04/2022,74.43,62.44,86.61,82.57,78.04,88.2,62.85,71,0,0,331.59,4.11,0.02,14.72,141,1017,96,66.78,2022,4,26,1,2,17,Spring,24.17,10.16,Warm,75.467949,14.7,Calm,74.43,No Rain,0,0,Humid,Sticky,Moderate,88.46030226,0.3859,72.36885949,0.159908759,2.061140511,5284.53,0
Apopka,27/04/2022,76.08,67.17,86.32,84.39,80.35,89.1,65.54,72,0,0,311.5,4.9,0.09,18.45,225,1014,96,68.94,2022,4,27,2,2,17,Spring,19.15,8.75,Warm,77.524608,18.36,Calm,76.08,No Rain,0,0,Humid,Uncomfortable,Moderate,90.35793643,0.5,72.36885949,0.159908759,3.711140511,5477.76,0
Apopka,28/04/2022,73.57,67.26,82.17,84.37,81.68,87.03,64.47,75,0,0,270.59,9.49,0.43,25.46,55,1014,96,67.48,2022,4,28,3,2,17,Spring,14.91,5.35,Warm,74.453575,25.03,Light,73.57,No Rain,0,0,Humid,Sticky,Moderate,82.04616729,0.5581,72.36885949,0.159908759,1.201140511,5517.75,0
Apopka,29/04/2022,71.99,61.9,80.6,82.63,79.47,85.95,61.59,71,0,0,266.17,7.68,0.67,23.58,85,1015,96,65.22,2022,4,29,4,2,17,Spring,18.7,6.48,Warm,72.456257,22.91,Light,71.99,No Rain,0,0,Humid,Sticky,Moderate,85.29483587,0.4067,72.36885949,0.159908759,-0.378859489,5111.29,0
Apopka,30/04/2022,74.38,66.45,83.88,83.09,80.02,86.83,63.51,70,0,0,245.85,6.5,0.07,19.37,98,1014,96,67.16,2022,4,30,5,2,17,Spring,17.43,6.81,Warm,75.39178,19.3,Light,74.38,No Rain,0,0,Humid,Sticky,Moderate,86.46024193,0.479,72.36885949,0.159908759,2.011140511,5206.6,0
Apopka,01/05/2022,73.69,63.77,85.39,83.11,80.26,86.29,65.96,79,0.07,0.04,210.97,3.98,0.05,18.83,94,1015,96,68.46,2022,5,1,6,2,17,Spring,21.62,6.03,Warm,74.651983,18.78,Calm,73.69,Light,1,0.16,Humid,Uncomfortable,Moderate,94.04133199,0.4837,72.36885949,0.159908759,1.321140511,5821.51,0.2786
Apopka,02/05/2022,74.33,64.26,86.81,81.97,78.3,86.94,67.43,81,0.26,0.14,303.37,5.03,0.02,21.38,109,1016,96,69.6,2022,5,2,0,2,18,Spring,22.55,8.64,Warm,75.487409,21.36,Light,74.33,Moderate,1,0.56,Very Humid,Uncomfortable,Moderate,96.48036325,0.9377,72.36885949,0.159908759,1.961140511,6020.73,1.3078
Apopka,03/05/2022,76.62,70.18,86.2,81.85,79.07,85.26,67.92,77,0,0,199.48,3.82,0.05,15.35,117,1015,96,70.61,2022,5,3,1,2,18,Spring,16.02,6.19,Warm,78.302142,15.3,Calm,76.62,No Rain,0,0,Humid,Uncomfortable,Low,90.45788648,0.4838,72.36885949,0.159908759,4.251140511,5899.74,0
Apopka,04/05/2022,77.2,65.61,88.86,83.35,78.64,89.51,66.55,72,0,0,310.42,4.05,0.02,13.98,132,1014,96,69.92,2022,5,4,2,2,18,Spring,23.25,10.87,Warm,78.91072,13.96,Calm,77.2,No Rain,0,0,Humid,Uncomfortable,Moderate,87.31385596,0.522,72.36885949,0.159908759,4.831140511,5558.4,0
Apopka,05/05/2022,79.73,68.65,91.99,85.97,81.3,91.96,68.17,71,0.29,0.14,324.46,3.52,0.02,12.84,217,1013,96,71.7,2022,5,5,3,2,18,Spring,23.34,10.66,Warm,82.009739,12.82,Calm,79.73,Moderate,1,0.56,Humid,Uncomfortable,Moderate,83.62657146,1.2073,72.36885949,0.159908759,7.361140511,5660.83,1.0208
Apopka,06/05/2022,80.32,72.23,89.56,85.99,82.27,89.96,69.46,72,0,0,296.07,6.85,0.02,26.71,234,1010,96,72.7,2022,5,6,4,2,18,Spring,17.33,7.69,Warm,82.772032,26.69,Light,80.32,No Rain,0,0,Humid,Uncomfortable,Moderate,83.28533732,0.79,72.36885949,0.159908759,7.951140511,5783.04,0
Apopka,07/05/2022,79.96,69.91,86.43,85.4,82.22,88.92,68.19,69,0.21,0.2,318.19,11.08,0.87,28.32,260,1006,96,71.78,2022,5,7,5,2,18,Spring,16.52,6.7,Warm,82.227892,27.45,Moderate,79.96,Moderate,1,0.8,Humid,Uncomfortable,Moderate,69.64434583,1.3612,72.36885949,0.159908759,7.591140511,5517.24,2.3268
Apopka,08/05/2022,77.92,71.55,88.39,85.82,81.45,91.53,64.71,66,0,0,338.83,7.43,0.51,20.4,286,1007,96,69.01,2022,5,8,6,2,18,Spring,16.84,10.08,Warm,79.644976,19.89,Light,77.92,No Rain,0,0,Humid,Sticky,Moderate,78.98802666,0.6932,72.36885949,0.159908759,5.551140511,5142.72,0
Apopka,09/05/2022,71.91,62.58,80.13,85.94,82.45,89.58,62.05,72,0,0,276.44,8.12,1.41,20.24,47,1013,96,65.47,2022,5,9,0,2,19,Spring,17.55,7.13,Warm,72.363816,18.83,Light,71.91,No Rain,0,0,Humid,Sticky,Moderate,84.80328507,0.4203,72.36885949,0.159908759,-0.458859489,5177.52,0
Apopka,10/05/2022,69.36,59.16,81.27,84.45,80.06,89.58,55.73,65,0,0,333.19,7.57,0.16,24.4,34,1016,96,60.98,2022,5,10,1,2,19,Spring,22.11,9.52,Mild,69.22272,24.24,Light,69.36,No Rain,0,0,Humid,Comfortable,Moderate,82.44998383,0.3348,72.36885949,0.159908759,-3.008859489,4508.4,0
Apopka,11/05/2022,70.29,60.04,82.13,84.12,79.95,88.86,57.57,66,0,0,323.62,7.87,0.18,25.99,15,1014,96,62.32,2022,5,11,2,2,19,Spring,22.09,8.91,Warm,70.353162,25.81,Light,70.29,No Rain,0,0,Humid,Comfortable,Moderate,82.35124681,0.3293,72.36885949,0.159908759,-2.078859489,4639.14,0
Apopka,12/05/2022,70.46,62.35,80.89,83.65,80.37,86.61,61.3,75,0,0,254.48,6.53,0.16,22.59,26,1012,96,64.53,2022,5,12,3,2,19,Spring,18.54,6.24,Warm,70.57385,22.43,Light,70.46,No Rain,0,0,Humid,Sticky,Moderate,92.17132577,0.2842,72.36885949,0.159908759,-1.908859489,5284.5,0
Apopka,13/05/2022,71.41,61.25,84.31,84.07,79.65,89.83,62.77,77,0.32,0.23,322.13,3.93,0.02,20.33,332,1011,96,65.74,2022,5,13,4,2,19,Spring,23.06,10.18,Warm,71.768281,20.31,Calm,71.41,Moderate,1,0.92,Humid,Sticky,Moderate,93.89895645,0.8677,72.36885949,0.159908759,-0.958859489,5498.57,1.2576
Apopka,14/05/2022,74.83,64.49,87.39,84.24,79.83,89.47,65.81,77,0.01,0.01,328.13,4.48,0,16.91,113,1011,96,68.72,2022,5,14,5,2,19,Spring,22.9,9.64,Warm,76.057303,16.91,Calm,74.83,Light,1,0.04,Humid,Uncomfortable,Moderate,93.37520809,0.4407,72.36885949,0.159908759,2.461140511,5761.91,0.0448
Apopka,15/05/2022,74.13,67.93,85.89,84.56,81.84,88.57,69.44,86,0.58,0.31,223.41,4.79,0.13,25.97,53,1011,96,70.87,2022,5,15,6,2,19,Spring,17.96,6.73,Warm,75.302094,25.84,Calm,74.13,Heavy,1,1.24,Very Humid,Uncomfortable,Moderate,92.49494808,1.5581,72.36885949,0.159908759,1.761140511,6375.18,2.7782
Apopka,16/05/2022,75.81,65.03,86.68,82.97,78.64,88.48,66.95,77,0,0,328.67,5.06,0.02,16.04,268,1010,96,69.75,2022,5,16,0,2,20,Spring,21.65,9.84,Warm,77.286321,16.02,Light,75.81,No Rain,0,0,Humid,Uncomfortable,Moderate,94.40301658,0.4929,72.36885949,0.159908759,3.441140511,5837.37,0
Apopka,17/05/2022,79.03,70.47,89.44,85.8,81.48,91.38,70.37,77,0,0,300.75,4.45,0.02,19.26,270,1012,96,72.92,2022,5,17,1,2,20,Spring,18.97,9.9,Warm,81.324523,19.24,Calm,79.03,No Rain,0,0,Humid,Oppressive,Moderate,90.76483845,0.6295,72.36885949,0.159908759,6.661140511,6085.31,0
Apopka,18/05/2022,80,71.82,90.99,87.64,83.88,91.98,71.34,77,0,0,285.77,4.7,0.05,21.16,277,1013,96,73.84,2022,5,18,2,2,20,Spring,19.17,8.1,Warm,82.541,21.11,Calm,80,No Rain,0,0,Humid,Oppressive,Moderate,90.87843249,0.688,72.36885949,0.159908759,7.631140511,6160,0
Apopka,19/05/2022,80.37,70.88,88.99,88.06,84.29,92.41,70.82,75,0,0,275.35,3.61,0.05,12.5,220,1012,96,73.6,2022,5,19,3,2,20,Spring,18.11,8.12,Warm,82.936575,12.45,Calm,80.37,No Rain,0,0,Humid,Oppressive,Moderate,86.24170162,0.6629,72.36885949,0.159908759,8.001140511,6027.75,0
Apopka,20/05/2022,76.25,70.03,85.93,86.38,82.98,89.85,71.38,86,1.26,0.49,137.42,4.59,0.09,25.86,165,1014,96,72.8,2022,5,20,4,2,20,Spring,15.9,6.87,Warm,78.02375,25.77,Calm,76.25,Very Heavy,1,1.96,Very Humid,Oppressive,Low,90.66184453,3.0161,72.36885949,0.159908759,3.881140511,6557.5,5.7834
Apopka,21/05/2022,77.67,68.97,90.86,83.13,80.37,87.4,71.34,83,1.36,0.47,221.95,6.17,0.07,33.89,128,1018,96,73.18,2022,5,21,5,2,20,Spring,21.89,7.03,Warm,79.770813,33.82,Light,77.67,Very Heavy,1,1.88,Very Humid,Oppressive,Moderate,90.10832937,3.3503,72.36885949,0.159908759,5.301140511,6446.61,8.3912
Apopka,22/05/2022,80.48,69.1,91.31,82.92,79.65,87.33,72.4,79,0,0,249.6,6.11,0.05,17.78,123,1019,96,74.69,2022,5,22,6,2,20,Spring,22.21,7.68,Warm,83.212136,17.73,Light,80.48,No Rain,0,0,Humid,Oppressive,Moderate,90.06369549,0.7684,72.36885949,0.159908759,8.111140511,6357.92,0
Apopka,23/05/2022,82.09,74.1,90.99,86.04,81.95,91.54,70.58,71,0,0,312.96,5.83,0.05,16.04,145,1016,96,73.92,2022,5,23,0,2,21,Spring,16.89,9.59,Warm,84.922687,15.99,Light,82.09,No Rain,0,0,Humid,Oppressive,Moderate,84.37756191,0.8377,72.36885949,0.159908759,9.721140511,5828.39,0
Apopka,24/05/2022,81.16,73.74,90.59,87.6,84.4,91.31,69.8,70,0,0,260.39,6.16,0.07,21.45,131,1014,96,73.16,2022,5,24,1,2,21,Spring,16.85,6.91,Warm,83.73796,21.38,Light,81.16,No Rain,0,0,Humid,Uncomfortable,Moderate,83.32952252,0.8044,72.36885949,0.159908759,8.791140511,5681.2,0
Apopka,25/05/2022,79.77,71.19,89.73,86.95,83.93,90.01,69.69,73,0,0,250.21,6.62,0.31,20.4,122,1015,96,72.69,2022,5,25,2,2,21,Spring,18.54,6.08,Warm,82.123593,20.09,Light,79.77,No Rain,0,0,Humid,Uncomfortable,Moderate,84.94488431,0.7533,72.36885949,0.159908759,7.401140511,5823.21,0
Apopka,26/05/2022,81.32,72.37,90.82,87.79,84.36,92.34,70.02,71,0.39,0.25,294.16,6.36,0.02,20.78,146,1015,96,73.35,2022,5,26,3,2,21,Spring,18.45,7.98,Warm,83.972276,20.76,Light,81.32,Moderate,1,1,Humid,Oppressive,Moderate,83.36284666,1.6004,72.36885949,0.159908759,8.951140511,5773.72,2.4804
Apopka,27/05/2022,77.14,71.1,88.09,85.63,83.91,89.74,71.89,85,0.9,0.16,196.02,4.43,0.02,20.6,181,1012,96,73.41,2022,5,27,4,2,21,Spring,16.99,5.83,Warm,79.14277,20.58,Calm,77.14,Heavy,1,0.64,Very Humid,Oppressive,Low,90.36754509,2.3342,72.36885949,0.159908759,4.771140511,6556.9,3.987
Apopka,28/05/2022,79.61,72.88,88.93,85.08,81.37,90.48,68.66,72,0,0,278.82,3.61,0,10.13,241,1010,96,71.98,2022,5,28,5,2,21,Spring,16.05,9.11,Warm,81.893336,10.13,Calm,79.61,No Rain,0,0,Humid,Uncomfortable,Moderate,84.63703044,0.6249,72.36885949,0.159908759,7.241140511,5731.92,0
Apopka,29/05/2022,79.81,68.9,91.18,87.35,82.72,93.42,68.01,70,0,0,347.8,4.9,0.05,19.89,312,1012,96,71.62,2022,5,29,6,2,21,Spring,22.28,10.7,Warm,82.07611,19.84,Calm,79.81,No Rain,0,0,Humid,Uncomfortable,Moderate,86.73938472,0.6865,72.36885949,0.159908759,7.441140511,5586.7,0
Apopka,30/05/2022,79.16,68.22,89.85,88.38,84.61,92.73,67.5,70,0,0,306.8,5.09,0,18.34,119,1014,96,71.11,2022,5,30,0,2,22,Spring,21.63,8.12,Warm,81.27596,18.34,Light,79.16,No Rain,0,0,Humid,Uncomfortable,Moderate,87.51649634,0.6616,72.36885949,0.159908759,6.791140511,5541.2,0
Apopka,31/05/2022,78.57,71.47,87.22,87.95,85.26,90.36,69,74,0,0,235.42,5.37,0.02,22.17,75,1014,96,71.89,2022,5,31,1,2,22,Spring,15.75,5.1,Warm,80.662794,22.15,Light,78.57,No Rain,0,0,Humid,Uncomfortable,Moderate,89.83981873,0.6433,72.36885949,0.159908759,6.201140511,5814.18,0
Apopka,01/06/2022,76.88,68.11,86.18,86.8,84.02,89.55,68.88,78,0.02,0.01,275.97,6.71,0.34,24.07,66,1012,96,71.32,2022,6,1,2,2,22,Summer,18.07,5.53,Warm,78.650912,23.73,Light,76.88,Light,1,0.04,Humid,Uncomfortable,Moderate,89.86900741,0.6524,72.36885949,0.159908759,4.511140511,5996.64,0.1342
Apopka,02/06/2022,79.21,68.72,89.82,87.01,83.5,91.29,68.7,73,0,0,304.54,5.2,0.07,17.16,91,1009,96,71.88,2022,6,2,3,2,22,Summer,21.1,7.79,Warm,81.428689,17.09,Light,79.21,No Rain,0,0,Humid,Uncomfortable,Moderate,89.24155874,0.6685,72.36885949,0.159908759,6.841140511,5782.33,0
Apopka,03/06/2022,77.2,71.35,85.32,87.24,85.1,89.19,70.74,81,0,0,177.44,4.54,0.02,15.84,154,1008,96,72.64,2022,6,3,4,2,22,Summer,13.97,4.09,Warm,79.12456,15.82,Calm,77.2,No Rain,0,0,Very Humid,Oppressive,Low,93.38737373,0.5416,72.36885949,0.159908759,4.831140511,6253.2,0
Apopka,04/06/2022,76.07,72.37,82.17,86.08,84.25,88.32,71.27,85,0.02,0.01,210.21,7.39,0.36,25.17,79,1004,96,72.68,2022,6,4,5,2,22,Summer,9.8,4.07,Warm,77.772635,24.81,Light,76.07,Light,1,0.04,Very Humid,Oppressive,Moderate,86.29423189,0.6391,72.36885949,0.159908759,3.701140511,6465.95,0.1478
Apopka,05/06/2022,77.41,69.78,90.05,87.01,83.21,92.3,71.93,84,0,0,306.95,4.88,0.05,21.65,339,1005,96,73.51,2022,6,5,6,2,22,Summer,20.27,9.09,Warm,79.464052,21.6,Calm,77.41,No Rain,0,0,Very Humid,Oppressive,Moderate,92.14726853,0.5657,72.36885949,0.159908759,5.041140511,6502.44,0
Apopka,06/06/2022,77.76,71.73,89.73,87.84,85.51,90.81,72.56,85,0.08,0.03,236.29,4.57,0.07,22.28,69,1009,96,74.04,2022,6,6,0,2,23,Summer,18,5.3,Warm,79.93668,22.21,Calm,77.76,Light,1,0.12,Very Humid,Oppressive,Moderate,90.38495501,0.7308,72.36885949,0.159908759,5.391140511,6609.6,0.3656
Apopka,07/06/2022,79.73,69.15,92.32,86.97,82.89,92.8,71.26,78,0,0,344.83,4.85,0.05,20.42,148,1011,96,73.71,2022,6,7,1,2,23,Summer,23.17,9.91,Warm,82.234502,20.37,Calm,79.73,No Rain,0,0,Humid,Oppressive,Moderate,92.14644582,0.6805,72.36885949,0.159908759,7.361140511,6218.94,0
Apopka,08/06/2022,79.07,73.65,92.59,89.17,86.04,93.07,72.55,82,0,0,265.32,4.3,0.02,27.49,200,1012,96,74.4,2022,6,8,2,2,23,Summer,18.94,7.03,Warm,81.524342,27.47,Calm,79.07,No Rain,0,0,Very Humid,Oppressive,Moderate,90.90583138,0.6255,72.36885949,0.159908759,6.701140511,6483.74,0
Apopka,09/06/2022,82.12,75.97,89.15,88.73,86,91.83,74.49,79,0,0,255.63,6.92,0.18,23.85,247,1012,96,76.56,2022,6,9,3,2,23,Summer,13.18,5.83,Warm,85.279684,23.67,Light,82.12,No Rain,0,0,Humid,Oppressive,Moderate,86.81832705,0.8828,72.36885949,0.159908759,9.751140511,6487.48,0
Apopka,10/06/2022,80.2,74.21,87.71,87.9,85.98,90.28,75.07,85,0.89,0.52,207.38,6.93,0.25,25.48,247,1010,96,76.45,2022,6,10,4,2,23,Summer,13.5,4.3,Warm,83.0611,25.23,Light,80.2,Heavy,1,2.08,Very Humid,Oppressive,Moderate,85.09237689,2.5672,72.36885949,0.159908759,7.831140511,6817,6.1677
Apopka,11/06/2022,78.49,73.24,89.82,85.99,82.62,90.45,72.77,83,0.01,0.01,268.32,5.79,0.13,23.42,217,1010,96,74.39,2022,6,11,5,2,23,Summer,16.58,7.83,Warm,80.815411,23.29,Light,78.49,Light,1,0.04,Very Humid,Oppressive,Moderate,90.67467816,0.6761,72.36885949,0.159908759,6.121140511,6514.67,0.0579
Apopka,12/06/2022,81.34,72.32,91.63,87.5,83.44,92.91,72.97,77,0,0,300.23,6.23,0.13,28.03,224,1013,96,75.31,2022,6,12,6,2,23,Summer,19.31,9.47,Warm,84.221494,27.9,Light,81.34,No Rain,0,0,Humid,Oppressive,Moderate,87.83710129,0.8162,72.36885949,0.159908759,8.971140511,6263.18,0
Apopka,13/06/2022,83.26,75.6,91.11,90.12,86.05,95.31,74.3,76,0,0,330.77,4.46,0.09,15.73,253,1015,96,76.73,2022,6,13,0,2,24,Summer,15.51,9.26,Warm,86.585608,15.64,Calm,83.26,No Rain,0,0,Humid,Oppressive,Moderate,87.56066868,0.8414,72.36885949,0.159908759,10.89114051,6327.76,0
Apopka,14/06/2022,83.61,73.27,94.53,91.94,88.14,96.78,73.55,75,0.31,0.2,324.31,3.76,0.02,21.34,290,1015,96,76.31,2022,6,14,1,2,24,Summer,21.26,8.64,Warm,86.978475,21.32,Calm,83.61,Moderate,1,0.8,Humid,Oppressive,Moderate,84.7108101,1.4509,72.36885949,0.159908759,11.24114051,6270.75,1.1656
Apopka,15/06/2022,83.52,75.78,94.44,90.8,87.31,95.16,74.03,76,0.07,0.04,300.43,3.56,0,14.83,245,1014,96,76.62,2022,6,15,2,2,24,Summer,18.66,7.85,Warm,86.910816,14.83,Calm,83.52,Light,1,0.16,Humid,Oppressive,Moderate,84.89453378,0.9584,72.36885949,0.159908759,11.15114051,6347.52,0.2492
Apopka,16/06/2022,84.23,74.79,95.83,90.2,86.56,94.59,73.85,73,0,0,304.91,5.2,0.07,19.04,99,1015,96,76.68,2022,6,16,3,2,24,Summer,21.04,8.03,Warm,87.658007,18.97,Light,84.23,No Rain,0,0,Humid,Oppressive,Moderate,86.22153591,0.9195,72.36885949,0.159908759,11.86114051,6148.79,0
Apopka,17/06/2022,83.67,74.28,92.73,91.16,87.4,95.45,72.43,71,0,0,285.42,4.73,0.02,15.26,83,1013,96,75.58,2022,6,17,4,2,24,Summer,18.45,8.05,Warm,86.872881,15.24,Calm,83.67,No Rain,0,0,Humid,Oppressive,Moderate,84.63045292,0.8727,72.36885949,0.159908759,11.30114051,5940.57,0
Apopka,18/06/2022,79.93,74.05,93.83,89.92,87.71,93.07,72.24,78,0.18,0.12,219,4.92,0.11,30.15,216,1010,96,74.43,2022,6,18,5,2,24,Summer,19.78,5.36,Warm,82.485982,30.04,Calm,79.93,Moderate,1,0.48,Humid,Oppressive,Moderate,92.22132658,1.0533,72.36885949,0.159908759,7.561140511,6234.54,0.8856
Apopka,19/06/2022,79.92,74.75,90.14,86.63,84.15,89.44,72.12,77,0,0,192.46,4.67,0.18,29.5,212,1012,96,74.34,2022,6,19,6,2,24,Summer,15.39,5.29,Warm,82.440672,29.32,Calm,79.92,No Rain,0,0,Humid,Oppressive,Low,90.84290303,0.6828,72.36885949,0.159908759,7.551140511,6153.84,0
Apopka,20/06/2022,81.37,72.88,91.38,87.12,83.98,90.99,72.69,76,0,0,245.81,6.8,0.13,24.52,83,1017,96,75.13,2022,6,20,0,2,25,Summer,18.5,7.01,Warm,84.221596,24.39,Light,81.37,No Rain,0,0,Humid,Oppressive,Moderate,85.54226915,0.8405,72.36885949,0.159908759,9.001140511,6184.12,0
Apopka,21/06/2022,79.67,70.11,89.83,88.35,84.67,92.75,66.54,68,0,0,318.13,5.73,0,21.43,65,1018,96,70.66,2022,6,21,1,2,25,Summer,19.72,8.08,Warm,81.839948,21.43,Light,79.67,No Rain,0,0,Humid,Uncomfortable,Moderate,84.05040141,0.7127,72.36885949,0.159908759,7.301140511,5417.56,0
Apopka,22/06/2022,79.77,68.54,89.69,88.89,85.32,92.84,65.86,65,0,0,264.04,3.93,0.11,15.43,109,1014,96,70.27,2022,6,22,2,2,25,Summer,21.15,7.52,Warm,81.865665,15.32,Calm,79.77,No Rain,0,0,Humid,Uncomfortable,Moderate,80.62205256,0.6457,72.36885949,0.159908759,7.401140511,5185.05,0
Apopka,23/06/2022,81.95,72.54,95.07,89.77,85.73,95.02,69.7,67,0,0,306.89,5.31,0.02,44.92,220,1009,96,73.32,2022,6,23,3,2,25,Summer,22.53,9.29,Warm,84.592145,44.9,Light,81.95,No Rain,0,0,Humid,Uncomfortable,Moderate,83.16266469,0.8099,72.36885949,0.159908759,9.581140511,5490.65,0
Apopka,24/06/2022,82.22,73.47,95.36,90.7,88.41,94.23,76.76,85,0.14,0.03,216.05,6.02,0.16,33.31,259,1010,96,78.18,2022,6,24,4,2,25,Summer,21.89,5.82,Warm,85.64771,33.15,Light,82.22,Moderate,1,0.12,Very Humid,Oppressive,Moderate,86.41475372,1.1318,72.36885949,0.159908759,9.851140511,6988.7,0.8428
Apopka,25/06/2022,78.98,72.52,89.38,87.53,85.23,90.34,74.22,86,0.19,0.13,203.04,4.31,0,17.74,52,1013,96,75.53,2022,6,25,5,2,25,Summer,16.86,5.11,Warm,81.528524,17.74,Calm,78.98,Moderate,1,0.52,Very Humid,Oppressive,Moderate,88.23867993,1.0014,72.36885949,0.159908759,6.611140511,6792.28,0.8189
Apopka,26/06/2022,80.36,72.88,89.28,86.3,83.39,89.17,71.59,77,0,0,229.98,6.71,0.87,20.78,55,1014,96,74.11,2022,6,26,6,2,25,Summer,16.4,5.78,Warm,82.992476,19.91,Light,80.36,No Rain,0,0,Humid,Oppressive,Moderate,87.0881505,0.7864,72.36885949,0.159908759,7.991140511,6187.72,0
Apopka,27/06/2022,80.77,72.39,90.86,87.35,84.2,91.15,73.66,80,0.22,0.13,248.58,4.74,0.02,18.03,87,1014,96,75.63,2022,6,27,0,2,26,Summer,18.47,6.95,Warm,83.61328,18.01,Calm,80.77,Moderate,1,0.52,Humid,Oppressive,Moderate,92.48467893,1.1681,72.36885949,0.159908759,8.401140511,6461.6,1.0428
Apopka,28/06/2022,80.74,74.77,91.81,87.07,83.91,91.38,73.86,81,0.1,0.09,264.85,4.93,0.07,33.26,117,1015,96,75.75,2022,6,28,1,2,26,Summer,17.04,7.47,Warm,83.610802,33.19,Calm,80.74,Light,1,0.36,Very Humid,Oppressive,Moderate,92.34526125,0.9342,72.36885949,0.159908759,8.371140511,6539.94,0.493
Apopka,29/06/2022,82.3,73.49,92.91,87.16,83.61,91.78,72.77,75,0,0,293.16,4.87,0,18.5,77,1017,96,75.43,2022,6,29,2,2,26,Summer,19.42,8.17,Warm,85.34425,18.5,Calm,82.3,No Rain,0,0,Humid,Oppressive,Moderate,88.59422426,0.8098,72.36885949,0.159908759,9.931140511,6172.5,0
Apopka,30/06/2022,79.64,73.87,90.88,88.53,85.28,92.53,73.47,82,0,0,252.49,4.55,0.02,23.73,55,1017,96,75.19,2022,6,30,3,2,26,Summer,17.01,7.25,Warm,82.248584,23.71,Calm,79.64,No Rain,0,0,Very Humid,Oppressive,Moderate,91.26006469,0.664,72.36885949,0.159908759,7.271140511,6530.48,0
Apopka,01/07/2022,78.64,72.68,89.47,87.59,85.41,90,73.06,84,0.06,0.01,160.13,3.4,0.05,26.35,168,1015,96,74.63,2022,7,1,4,3,26,Summer,16.79,4.59,Warm,81.035008,26.3,Calm,78.64,Light,1,0.04,Very Humid,Oppressive,Low,87.2802087,0.688,72.36885949,0.159908759,6.271140511,6605.76,0.204
Apopka,02/07/2022,77.23,72.64,87.89,84.97,83.25,86.7,74.81,93,0.12,0.02,148.25,2.84,0,18.01,130,1015,95,75.47,2022,7,2,5,3,26,Summer,15.25,3.45,Warm,79.448887,18.01,Calm,77.23,Moderate,1,0.08,Very Humid,Oppressive,Low,80.38120159,0.7151,72.36885949,0.159908759,4.861140511,7182.39,0.3408
Apopka,03/07/2022,77.99,73.31,87.28,83.83,81.99,86.81,74.84,91,0.55,0.23,175.84,3.7,0,18.25,135,1016,96,75.7,2022,7,3,6,3,26,Summer,13.97,4.82,Warm,80.389397,18.25,Calm,77.99,Heavy,1,0.92,Very Humid,Oppressive,Low,83.69675379,1.6475,72.36885949,0.159908759,5.621140511,7097.09,2.035
Apopka,04/07/2022,82.06,72.55,92.75,85.06,80.96,90.75,73.64,78,0,0,304.87,3.94,0.02,15.12,141,1016,96,75.96,2022,7,4,0,3,27,Summer,20.2,9.79,Warm,85.164244,15.1,Calm,82.06,No Rain,0,0,Humid,Oppressive,Moderate,88.20711693,0.7606,72.36885949,0.159908759,9.691140511,6400.68,0
Apopka,05/07/2022,83.18,75.11,92.14,88.31,84.58,93.18,74.24,76,0,0,275.5,4.59,0,16.75,135,1015,96,76.67,2022,7,5,1,3,27,Summer,17.03,8.6,Warm,86.485544,16.75,Calm,83.18,No Rain,0,0,Humid,Oppressive,Moderate,87.97131155,0.8426,72.36885949,0.159908759,10.81114051,6321.68,0
Apopka,06/07/2022,81.21,75.11,92.34,89.26,86,93.38,75.16,83,0,0,253.93,4.25,0.02,22.12,142,1014,96,76.78,2022,7,6,2,3,27,Summer,17.23,7.38,Warm,84.280419,22.1,Calm,81.21,No Rain,0,0,Very Humid,Oppressive,Moderate,88.79168717,0.7305,72.36885949,0.159908759,8.841140511,6740.43,0
Apopka,07/07/2022,82.02,74.71,92.98,89.77,86.13,94.5,74.88,81,0.01,0.01,311.54,4.45,0.09,23.51,187,1014,96,76.8,2022,7,7,3,3,27,Summer,18.27,8.37,Warm,85.232946,23.42,Calm,82.02,Light,1,0.04,Very Humid,Oppressive,Moderate,90.23669859,0.799,72.36885949,0.159908759,9.651140511,6643.62,0.0445
Apopka,08/07/2022,84.39,75.07,95.59,91.01,87.21,95.95,72.61,71,0,0,332.04,4.41,0.07,16.35,178,1015,96,75.89,2022,7,8,4,3,27,Summer,20.52,8.74,Warm,87.761577,16.28,Calm,84.39,No Rain,0,0,Humid,Oppressive,Moderate,83.30495757,0.8959,72.36885949,0.159908759,12.02114051,5991.69,0
Apopka,09/07/2022,83.94,76.05,95.47,92.56,89.17,96.87,75.38,77,0.11,0.08,307.67,4.65,0.02,25.59,213,1015,96,77.65,2022,7,9,5,3,27,Summer,19.42,7.7,Warm,87.482154,25.57,Calm,83.94,Moderate,1,0.32,Humid,Oppressive,Moderate,88.36870683,1.103,72.36885949,0.159908759,11.57114051,6463.38,0.5115
Apopka,10/07/2022,80.45,72.12,90.72,90.77,88.47,94.06,75.51,86,0.36,0.21,274.5,4.78,0.05,28.1,207,1012,96,76.83,2022,7,10,6,3,27,Summer,18.6,5.59,Warm,83.41571,28.05,Calm,80.45,Moderate,1,0.84,Very Humid,Oppressive,Moderate,88.66496185,1.4337,72.36885949,0.159908759,8.081140511,6918.7,1.7208
Apopka,11/07/2022,81.79,74.59,90.88,87.37,85.48,89.26,75.72,83,0.19,0.15,217.22,5.02,0.13,31.63,198,1011,96,77.33,2022,7,11,0,3,28,Summer,16.29,3.78,Warm,85.019281,31.5,Light,81.79,Moderate,1,0.6,Very Humid,Oppressive,Moderate,90.58996458,1.1703,72.36885949,0.159908759,9.421140511,6788.57,0.9538
Apopka,12/07/2022,84.63,76.91,94.24,88.1,84.15,93.85,75.37,75,0,0,333.13,4.87,0.11,19.53,242,1012,96,77.83,2022,7,12,1,3,28,Summer,17.33,9.7,Warm,88.250925,19.42,Calm,84.63,No Rain,0,0,Humid,Oppressive,Moderate,87.19250052,0.9263,72.36885949,0.159908759,12.26114051,6347.25,0
Apopka,13/07/2022,83.55,73.31,95.38,90.93,87.24,96.4,74.45,76,1.43,0.76,316.67,4.06,0,19.73,234,1015,95,76.91,2022,7,13,2,3,28,Summer,22.07,9.16,Warm,86.94834,19.73,Calm,83.55,Very Heavy,1,3.04,Humid,Oppressive,Moderate,86.27077438,3.6999,72.36885949,0.159908759,11.18114051,6349.8,5.8058
Apopka,14/07/2022,80.49,73.83,93.65,89.14,85.96,93.87,74.64,84,0.17,0.16,274.17,4.1,0.02,26.98,221,1016,95,76.23,2022,7,14,3,3,28,Summer,19.82,7.91,Warm,83.397828,26.96,Calm,80.49,Moderate,1,0.64,Very Humid,Oppressive,Moderate,88.11925603,1.0285,72.36885949,0.159908759,8.121140511,6761.16,0.697
Apopka,15/07/2022,81.34,71.04,92.75,88.21,84.54,92.62,71.32,74,0,0,306.62,4.94,0.02,21.7,93,1016,96,74.21,2022,7,15,4,3,28,Summer,21.71,8.08,Warm,84.109228,21.68,Calm,81.34,No Rain,0,0,Humid,Oppressive,Moderate,88.67966364,0.7646,72.36885949,0.159908759,8.971140511,6019.16,0
Apopka,16/07/2022,77.94,71.51,85.6,87.25,84.34,90.25,73.54,87,1.96,0.88,221.26,4.88,0.07,20.67,75,1015,96,74.77,2022,7,16,5,3,28,Summer,14.09,5.91,Warm,80.219574,20.6,Calm,77.94,Very Heavy,1,3.52,Very Humid,Oppressive,Moderate,89.76653571,4.5122,72.36885949,0.159908759,5.571140511,6780.78,9.5648
Apopka,17/07/2022,78.14,71.8,90.32,84.98,82.08,89.46,73.55,87,0.19,0.15,226.09,3.67,0.02,21.36,97,1014,96,74.83,2022,7,17,6,3,28,Summer,18.52,7.38,Warm,80.476994,21.34,Calm,78.14,Moderate,1,0.6,Very Humid,Oppressive,Moderate,86.27203781,0.9338,72.36885949,0.159908759,5.771140511,6798.18,0.6973
Apopka,18/07/2022,81.51,73.96,91.6,85.02,82.2,87.8,75.26,82,0.02,0.02,222.6,4.57,0.07,36.53,165,1015,96,76.94,2022,7,18,0,3,29,Summer,17.64,5.6,Warm,84.624606,36.46,Calm,81.51,Light,1,0.08,Very Humid,Oppressive,Moderate,90.19084765,0.7983,72.36885949,0.159908759,9.141140511,6683.82,0.0914
Apopka,19/07/2022,80.13,76.21,90.84,85.86,83.64,89.56,76.13,88,0.58,0.45,203.89,3.45,0,28.86,178,1016,96,77.19,2022,7,19,1,3,29,Summer,14.63,5.92,Warm,83.071752,28.86,Calm,80.13,Heavy,1,1.8,Very Humid,Oppressive,Moderate,83.77407522,1.8045,72.36885949,0.159908759,7.761140511,7051.44,2.001
Apopka,20/07/2022,80.51,74.61,90.41,85.42,82.6,88.95,75.42,86,0.1,0.1,242.99,3.85,0,22.26,194,1015,96,76.78,2022,7,20,2,3,29,Summer,15.8,6.35,Warm,83.492738,22.26,Calm,80.51,Light,1,0.4,Very Humid,Oppressive,Moderate,86.03548927,0.8795,72.36885949,0.159908759,8.141140511,6923.86,0.385
Apopka,21/07/2022,83.51,73.47,93.43,86.94,82.76,92.73,73.4,74,0,0,337.85,4.54,0.05,17.58,195,1014,96,76.19,2022,7,21,3,3,29,Summer,19.96,9.97,Warm,86.809142,17.53,Calm,83.51,No Rain,0,0,Humid,Oppressive,Moderate,86.25876477,0.8571,72.36885949,0.159908759,11.14114051,6179.74,0
Apopka,22/07/2022,84.09,76.91,93.47,89.07,86.16,92.14,74.33,74,0,0,231.83,3.84,0.05,16.06,149,1015,96,76.97,2022,7,22,4,3,29,Summer,16.56,5.98,Warm,87.530778,16.01,Calm,84.09,No Rain,0,0,Humid,Oppressive,Moderate,83.95783388,0.8581,72.36885949,0.159908759,11.72114051,6222.66,0
Apopka,23/07/2022,81.62,76.3,90.61,88.49,86.14,90.63,75.06,81,0,0,201.56,3.79,0.02,19.37,120,1017,96,76.83,2022,7,23,5,3,29,Summer,14.31,4.49,Warm,84.726026,19.35,Calm,81.62,No Rain,0,0,Very Humid,Oppressive,Moderate,88.63687699,0.7326,72.36885949,0.159908759,9.251140511,6611.22,0
Apopka,24/07/2022,83.26,73.94,94.46,88.78,85.33,93.42,72.9,74,0,0,289.4,4.63,0.09,15.41,104,1017,96,75.79,2022,7,24,6,3,29,Summer,20.52,8.09,Warm,86.498092,15.32,Calm,83.26,No Rain,0,0,Humid,Oppressive,Moderate,86.66013626,0.8482,72.36885949,0.159908759,10.89114051,6161.24,0
Apopka,25/07/2022,81.25,74.17,94.03,89.46,86.76,92.71,73.74,80,0.05,0.05,252.03,3.63,0.02,24.56,93,1016,96,75.81,2022,7,25,0,3,30,Summer,19.86,5.95,Warm,84.22,24.54,Calm,81.25,Light,1,0.2,Humid,Oppressive,Moderate,89.10059124,0.8077,72.36885949,0.159908759,8.881140511,6500,0.1815
Apopka,26/07/2022,78.74,72.66,90.3,86.87,84.52,89.91,74.1,87,1.56,0.78,171.02,4.04,0.07,32.1,109,1017,96,75.38,2022,7,26,1,3,30,Summer,17.64,5.39,Warm,81.249254,32.03,Calm,78.74,Very Heavy,1,3.12,Very Humid,Oppressive,Low,86.94285242,3.7186,72.36885949,0.159908759,6.371140511,6850.38,6.3024
Apopka,27/07/2022,79.46,70.18,93.76,85.06,81.99,91.04,72.22,82,1.52,0.5,299.07,4.4,0.11,26.15,135,1017,96,74.28,2022,7,27,2,3,30,Summer,23.58,9.05,Warm,82.019876,26.04,Calm,79.46,Very Heavy,1,2,Very Humid,Oppressive,Moderate,90.9500658,3.689,72.36885949,0.159908759,7.091140511,6515.72,6.688
Apopka,28/07/2022,83.08,72.95,94.08,86.11,82.04,92.03,74.07,77,0.01,0.01,315.05,3.43,0.05,10.38,175,1016,96,76.53,2022,7,28,3,3,30,Summer,21.13,9.99,Warm,86.403628,10.33,Calm,83.08,Light,1,0.04,Humid,Oppressive,Moderate,85.48401722,0.8112,72.36885949,0.159908759,10.71114051,6397.16,0.0343
Apopka,29/07/2022,84.1,74.44,94.33,89.44,85.44,94.68,73.34,72,0,0,319.2,4.62,0.07,14.32,184,1017,96,76.3,2022,7,29,4,3,30,Summer,19.89,9.24,Warm,87.45016,14.25,Calm,84.1,No Rain,0,0,Humid,Oppressive,Moderate,84.75231749,0.8898,72.36885949,0.159908759,11.73114051,6055.2,0
Apopka,30/07/2022,83.65,73.63,94.66,90.44,86.97,94.59,73.18,74,0,0,272.17,4.36,0.02,16.8,115,1018,96,76.07,2022,7,30,5,3,30,Summer,21.03,7.62,Warm,86.98333,16.78,Calm,83.65,No Rain,0,0,Humid,Oppressive,Moderate,85.67259716,0.8569,72.36885949,0.159908759,11.28114051,6190.1,0
Apopka,31/07/2022,83.08,74.77,91.65,90.09,87.44,92.43,74.61,77,0,0,205.72,4.48,0.02,14.99,113,1019,96,76.9,2022,7,31,6,3,30,Summer,16.88,4.99,Warm,86.403628,14.97,Calm,83.08,No Rain,0,0,Humid,Oppressive,Moderate,88.41202315,0.8332,72.36885949,0.159908759,10.71114051,6397.16,0
Apopka,01/08/2022,84.11,74.57,94.53,90.6,86.95,95.58,73.72,74,0,0,332.36,4.52,0.02,28.16,186,1018,96,76.56,2022,8,1,0,3,31,Summer,19.96,8.63,Warm,87.555662,28.14,Calm,84.11,No Rain,0,0,Humid,Oppressive,Moderate,85.84203433,0.8863,72.36885949,0.159908759,11.74114051,6224.14,0
Apopka,02/08/2022,80.59,72.66,94.12,90.87,87.53,94.89,73.32,80,1.74,0.61,251.89,4.62,0.02,32.95,222,1015,96,75.34,2022,8,2,1,3,31,Summer,21.46,7.36,Warm,83.38576,32.93,Calm,80.59,Very Heavy,1,2.44,Humid,Oppressive,Moderate,92.25833735,4.1943,72.36885949,0.159908759,8.221140511,6447.2,8.0388
Apopka,03/08/2022,79.49,71.78,92.21,87.34,84.04,92.48,73.84,85,0.49,0.34,298.34,3.79,0.02,25.21,183,1014,96,75.4,2022,8,3,2,3,31,Summer,20.43,8.44,Warm,82.151945,25.19,Calm,79.49,Moderate,1,1.36,Very Humid,Oppressive,Moderate,87.16910005,1.6061,72.36885949,0.159908759,7.121140511,6756.65,1.8571
Apopka,04/08/2022,81.54,74.84,92.3,87.34,84.38,90.9,74.23,80,0,0,248.72,4.42,0.02,16.91,94,1015,96,76.23,2022,8,4,3,3,31,Summer,17.46,6.52,Warm,84.58656,16.89,Calm,81.54,No Rain,0,0,Humid,Oppressive,Moderate,91.12910367,0.7538,72.36885949,0.159908759,9.171140511,6523.2,0
Apopka,05/08/2022,80.69,74.75,90.12,86.89,84.76,89.06,75.55,85,0.24,0.09,190.6,3.58,0,28.05,90,1016,96,76.92,2022,8,5,4,3,31,Summer,15.37,4.3,Warm,83.688545,28.05,Calm,80.69,Moderate,1,0.36,Very Humid,Oppressive,Low,85.86158105,1.1577,72.36885949,0.159908759,8.321140511,6858.65,0.8592
Apopka,06/08/2022,80.95,75.72,88.14,85.68,83.5,87.96,75.72,85,0.07,0.04,190.9,3.18,0.02,19.66,88,1018,96,77.11,2022,8,6,5,3,31,Summer,12.42,4.46,Warm,84.021475,19.64,Calm,80.95,Light,1,0.16,Very Humid,Oppressive,Low,84.58973469,0.8147,72.36885949,0.159908759,8.581140511,6880.75,0.2226
Apopka,07/08/2022,81.06,73.72,90.27,85.67,82.8,88.9,74.36,81,0.14,0.12,275.72,5.32,0.09,23.31,84,1018,96,76.19,2022,8,7,6,3,31,Summer,16.55,6.1,Warm,84.016338,23.22,Light,81.06,Moderate,1,0.48,Very Humid,Oppressive,Moderate,91.81379261,1.0458,72.36885949,0.159908759,8.691140511,6565.86,0.7448
Apopka,08/08/2022,78.9,75.22,87.82,85.11,83.53,86.4,75.14,89,0.02,0.01,133.21,3.75,0.05,17.54,78,1017,96,76.16,2022,8,8,0,3,32,Summer,12.6,2.87,Warm,81.51393,17.49,Calm,78.9,Light,1,0.04,Very Humid,Oppressive,Low,84.66331883,0.635,72.36885949,0.159908759,6.531140511,7022.1,0.075
Apopka,09/08/2022,81.2,74.75,89.85,84.92,82.38,87.85,75.94,85,0,0,186.35,4.01,0.13,17.9,102,1017,96,77.33,2022,8,9,1,3,32,Summer,15.1,5.47,Warm,84.3416,17.77,Calm,81.2,No Rain,0,0,Very Humid,Oppressive,Low,86.75385413,0.7204,72.36885949,0.159908759,8.831140511,6902,0
Apopka,10/08/2022,82.68,76.23,93.67,87.17,83.86,92.21,74.45,78,0.01,0.01,262.48,4.08,0.05,26.91,116,1018,96,76.68,2022,8,10,2,3,32,Summer,17.44,8.35,Warm,85.943832,26.86,Calm,82.68,Light,1,0.04,Humid,Oppressive,Moderate,88.22452685,0.8172,72.36885949,0.159908759,10.31114051,6449.04,0.0408
Apopka,11/08/2022,80.77,75.29,88.16,87.5,85.26,89.91,74.59,82,0.03,0.03,195.18,4.22,0,17.38,134,1016,96,76.27,2022,8,11,3,3,32,Summer,12.87,4.65,Warm,83.684362,17.38,Calm,80.77,Light,1,0.12,Very Humid,Oppressive,Low,89.66002832,0.7673,72.36885949,0.159908759,8.401140511,6623.14,0.1266
Apopka,12/08/2022,80.88,74.23,92.12,87.21,84.04,91.76,73.24,79,0.85,0.45,242.69,3.64,0,21.72,102,1015,96,75.37,2022,8,12,4,3,32,Summer,17.89,7.72,Warm,83.716416,21.72,Calm,80.88,Heavy,1,1.8,Humid,Oppressive,Moderate,88.76772492,2.3896,72.36885949,0.159908759,8.511140511,6389.52,3.094
Apopka,13/08/2022,80.08,74.05,89.89,86.9,84.09,89.76,74.09,84,0.03,0.01,225.36,4.28,0.02,16.31,39,1013,96,75.74,2022,8,13,5,3,32,Summer,15.84,5.67,Warm,82.874176,16.29,Calm,80.08,Light,1,0.04,Very Humid,Oppressive,Moderate,88.86785516,0.7352,72.36885949,0.159908759,7.711140511,6726.72,0.1284
Apopka,14/08/2022,77.68,71.76,86.74,86.27,83.88,88.9,73.98,89,0.06,0.02,178.84,3.45,0.02,19.66,78,1012,96,75.01,2022,8,14,6,3,32,Summer,14.98,5.02,Warm,79.935616,19.64,Calm,77.68,Light,1,0.08,Very Humid,Oppressive,Low,84.56069548,0.642,72.36885949,0.159908759,5.311140511,6913.52,0.207
Apopka,15/08/2022,81.49,73.44,90.18,86.67,83.16,91.63,71.65,75,0,0,294.02,3.56,0.02,12.28,61,1010,96,74.46,2022,8,15,0,3,33,Summer,16.74,8.47,Warm,84.333775,12.26,Calm,81.49,No Rain,0,0,Humid,Oppressive,Moderate,85.42848281,0.7169,72.36885949,0.159908759,9.121140511,6111.75,0
Apopka,16/08/2022,83.46,75.81,92.95,89.2,85.62,93.52,73.93,75,0,0,281.25,4.49,0.05,14.5,240,1010,96,76.53,2022,8,16,1,3,33,Summer,17.14,7.9,Warm,86.79135,14.45,Calm,83.46,No Rain,0,0,Humid,Oppressive,Moderate,86.83671109,0.8526,72.36885949,0.159908759,11.09114051,6259.5,0
Apopka,17/08/2022,82.51,77.61,88.7,89.55,87.1,91.98,75.52,80,0,0,213.87,5.66,0.18,21.63,252,1011,96,77.38,2022,8,17,2,3,33,Summer,11.09,4.88,Warm,85.81264,21.45,Light,82.51,No Rain,0,0,Humid,Oppressive,Moderate,90.68065431,0.8519,72.36885949,0.159908759,10.14114051,6600.8,0
Apopka,18/08/2022,78.94,74.55,92.14,88.3,86.25,90.77,75.34,89,0.16,0.05,175.98,3.48,0.02,29.86,192,1011,96,76.31,2022,8,18,3,3,33,Summer,17.59,4.52,Warm,81.565678,29.84,Calm,78.94,Moderate,1,0.2,Very Humid,Oppressive,Low,83.8863391,0.9062,72.36885949,0.159908759,6.571140511,7025.66,0.5568
Apopka,19/08/2022,79.41,72.59,93.88,86.97,83.5,92.05,73.43,84,0.1,0.08,283.53,4.09,0,34.76,210,1013,96,75.09,2022,8,19,4,3,33,Summer,21.29,8.55,Warm,82.018452,34.76,Calm,79.41,Light,1,0.32,Very Humid,Oppressive,Moderate,88.74109629,0.8341,72.36885949,0.159908759,7.041140511,6670.44,0.409
Apopka,20/08/2022,80.78,72.99,93.99,87.85,84.31,92.48,74.68,83,0.02,0.02,298.58,3.95,0.02,17.6,107,1016,96,76.34,2022,8,20,5,3,33,Summer,21,8.17,Warm,83.732642,17.58,Calm,80.78,Light,1,0.08,Very Humid,Oppressive,Moderate,88.21380126,0.737,72.36885949,0.159908759,8.411140511,6704.74,0.079
Apopka,21/08/2022,83.33,76.73,92.59,89.32,86.22,93,76.96,82,0,0,239.53,4.14,0.25,18.61,118,1016,96,78.61,2022,8,21,6,3,33,Summer,15.86,6.78,Warm,86.937098,18.36,Calm,83.33,No Rain,0,0,Very Humid,Oppressive,Moderate,87.89685083,0.8321,72.36885949,0.159908759,10.96114051,6833.06,0
Apopka,22/08/2022,83.14,76.35,92.44,90.11,86.97,93.72,75.42,79,0,0,238.87,3.52,0.02,18.5,101,1013,96,77.48,2022,8,22,0,3,34,Summer,16.09,6.75,Warm,86.565598,18.48,Calm,83.14,No Rain,0,0,Humid,Oppressive,Moderate,87.07348379,0.7978,72.36885949,0.159908759,10.77114051,6568.06,0
Apopka,23/08/2022,81.44,76.05,91.2,90.31,87.64,93.51,74.95,82,0.02,0.02,211.09,3.45,0,20.24,156,1011,96,76.7,2022,8,23,1,3,34,Summer,15.15,5.87,Warm,84.535664,20.24,Calm,81.44,Light,1,0.08,Very Humid,Oppressive,Moderate,87.10975319,0.75,72.36885949,0.159908759,9.071140511,6678.08,0.069
Apopka,24/08/2022,80.29,74.64,92.43,88.84,86.52,93.6,75.67,87,3.24,0.98,236.61,3.94,0.05,28.65,74,1012,96,76.9,2022,8,24,2,3,34,Summer,17.79,7.08,Warm,83.244259,28.6,Calm,80.29,Very Heavy,1,3.92,Very Humid,Oppressive,Moderate,85.73151754,7.1521,72.36885949,0.159908759,7.921140511,6985.23,12.7656
Apopka,25/08/2022,79.87,72.7,91.98,85.08,81.93,88.39,75.76,88,2.99,0.83,224.59,5.17,0,29.57,83,1014,96,76.86,2022,8,25,3,3,34,Summer,19.28,6.46,Warm,82.736248,29.57,Light,79.87,Very Heavy,1,3.32,Very Humid,Oppressive,Moderate,88.13691416,6.6803,72.36885949,0.159908759,7.501140511,7028.56,15.4583
Apopka,26/08/2022,78.9,74.08,90.75,85.84,82.85,90.91,75.7,91,0.38,0.15,216.92,3.58,0.05,26.06,99,1013,96,76.56,2022,8,26,4,3,34,Summer,16.67,8.06,Warm,81.57267,26.01,Calm,78.9,Moderate,1,0.6,Very Humid,Oppressive,Moderate,82.81467021,1.3482,72.36885949,0.159908759,6.531140511,7179.9,1.3604
Apopka,27/08/2022,78.99,74.32,89.24,86.2,82.85,90.01,75.74,91,0.15,0.04,224.15,3.28,0.02,18.12,106,1011,96,76.61,2022,8,27,5,3,34,Summer,14.92,7.16,Warm,81.689697,18.1,Calm,78.99,Moderate,1,0.16,Very Humid,Oppressive,Moderate,81.92395325,0.8807,72.36885949,0.159908759,6.621140511,7188.09,0.492
Apopka,28/08/2022,78.48,73.47,90.45,85.62,83.35,88.81,76.16,93,1.49,0.47,182.1,3.6,0.02,21.18,89,1011,96,76.78,2022,8,28,6,3,34,Summer,16.98,5.46,Warm,81.082512,21.16,Calm,78.48,Very Heavy,1,1.88,Very Humid,Oppressive,Low,81.74852245,3.548,72.36885949,0.159908759,6.111140511,7298.64,5.364
Apopka,29/08/2022,79.82,74.16,89.46,84.16,81.34,87.73,75.4,88,0,0,176.38,3.63,0.02,15.61,98,1012,96,76.59,2022,8,29,0,3,35,Summer,15.3,6.39,Warm,82.671728,15.59,Calm,79.82,No Rain,0,0,Very Humid,Oppressive,Low,84.46251453,0.6362,72.36885949,0.159908759,7.451140511,7024.16,0
Apopka,30/08/2022,81.92,76.24,91.49,85.77,82.67,89.46,75.92,83,0,0,207.85,4.51,0.05,16.55,156,1012,96,77.51,2022,8,30,1,3,35,Summer,15.25,6.79,Warm,85.184888,16.5,Calm,81.92,No Rain,0,0,Very Humid,Oppressive,Moderate,89.08958251,0.7764,72.36885949,0.159908759,9.551140511,6799.36,0
Apopka,31/08/2022,80.22,74.57,93.11,86.98,83.71,91.69,75.21,86,0.04,0.02,238.33,3.83,0.05,21.68,182,1012,96,76.56,2022,8,31,2,3,35,Summer,18.54,7.98,Warm,83.120436,21.63,Calm,80.22,Light,1,0.08,Very Humid,Oppressive,Moderate,86.1541812,0.7442,72.36885949,0.159908759,7.851140511,6898.92,0.1532
Apopka,01/09/2022,79.91,73.11,91.87,86.91,83.73,90.68,74.05,84,0.01,0.01,212.16,3.34,0.02,17.34,93,1012,96,75.66,2022,9,1,3,3,35,Fall,18.76,6.95,Warm,82.657052,17.32,Calm,79.91,Light,1,0.04,Very Humid,Oppressive,Moderate,86.34886439,0.6491,72.36885949,0.159908759,7.541140511,6712.44,0.0334
Apopka,02/09/2022,78.87,73.24,89.53,86.88,84,90.36,74.31,87,0.07,0.03,198.27,3.93,0.02,21.47,81,1014,96,75.56,2022,9,2,4,3,35,Fall,16.29,6.36,Warm,81.416577,21.45,Calm,78.87,Light,1,0.12,Very Humid,Oppressive,Low,86.55790118,0.7407,72.36885949,0.159908759,6.501140511,6861.69,0.2751
Apopka,03/09/2022,80.26,73.38,92.17,86.27,83.21,90.39,74.67,85,0.8,0.25,210.33,4.03,0,25.9,67,1014,96,76.19,2022,9,3,5,3,35,Fall,18.79,7.18,Warm,83.13793,25.9,Calm,80.26,Heavy,1,1,Very Humid,Oppressive,Moderate,87.37512795,2.2742,72.36885949,0.159908759,7.891140511,6822.1,3.224
Apopka,04/09/2022,81.71,75.51,91.58,86.59,83.12,91.04,76,84,0,0,249.04,3.87,0.07,17.94,91,1013,96,77.51,2022,9,4,6,3,35,Fall,16.07,7.92,Warm,84.956012,17.87,Calm,81.71,No Rain,0,0,Very Humid,Oppressive,Moderate,86.74393353,0.7403,72.36885949,0.159908759,9.341140511,6863.64,0
Apopka,05/09/2022,82.89,74.64,93.6,88.34,84.52,93.31,75.34,80,0,0,266.55,3.32,0.05,11.48,119,1013,96,77.35,2022,9,5,0,3,36,Fall,18.96,8.79,Warm,86.29296,11.43,Calm,82.89,No Rain,0,0,Humid,Oppressive,Moderate,87.24951134,0.7773,72.36885949,0.159908759,10.52114051,6631.2,0
Apopka,06/09/2022,83.63,76.69,93.96,90.18,86.25,95.14,76.19,80,0,0,283.26,3.29,0.02,23.69,164,1014,96,78.14,2022,9,6,1,3,36,Fall,17.27,8.89,Warm,87.22832,23.67,Calm,83.63,No Rain,0,0,Humid,Oppressive,Moderate,86.72067138,0.8131,72.36885949,0.159908759,11.26114051,6690.4,0
Apopka,07/09/2022,81.97,74.25,92.41,90.95,87.44,95.14,74.97,80,0.01,0.01,263.44,4.01,0.02,23.62,256,1010,96,76.85,2022,9,7,2,3,36,Fall,18.16,7.7,Warm,85.13008,23.6,Calm,81.97,Light,1,0.04,Humid,Oppressive,Moderate,89.72709985,0.7789,72.36885949,0.159908759,9.601140511,6557.6,0.0401
Apopka,08/09/2022,76,71.76,86.05,87.7,84.65,91.33,73.24,92,0.55,0.16,104.64,3.9,0.05,17.83,86,1005,96,74.02,2022,9,8,3,3,36,Fall,14.29,6.68,Warm,77.8216,17.78,Calm,76,Heavy,1,0.64,Very Humid,Oppressive,Low,84.76435431,1.556,72.36885949,0.159908759,3.631140511,6992,2.145
Apopka,09/09/2022,76.6,70.57,88.57,83.67,81.63,85.95,74.12,93,0.5,0.38,158.31,3.28,0.05,26.95,151,1006,96,74.81,2022,9,9,4,3,36,Fall,18,4.32,Warm,78.62554,26.9,Calm,76.6,Moderate,1,1.52,Very Humid,Oppressive,Low,81.98718236,1.4612,72.36885949,0.159908759,4.231140511,7123.8,1.64
Apopka,10/09/2022,78.14,73.99,90.93,83.18,81.07,86.04,75.1,91,0.22,0.14,154.2,4.21,0,28.92,137,1013,96,75.93,2022,9,10,5,3,36,Fall,16.94,4.97,Warm,80.584442,28.92,Calm,78.14,Moderate,1,0.56,Very Humid,Oppressive,Low,85.02868838,1.0154,72.36885949,0.159908759,5.771140511,7110.74,0.9262
Apopka,11/09/2022,80.46,72.39,92.05,84.47,80.35,90.14,74.29,83,0,0,277.37,3.42,0.02,24.72,127,1015,96,75.98,2022,9,11,6,3,36,Fall,19.66,9.79,Warm,83.324994,24.7,Calm,80.46,No Rain,0,0,Very Humid,Oppressive,Moderate,86.92836682,0.6598,72.36885949,0.159908759,8.091140511,6678.18,0
Apopka,12/09/2022,80.21,75,90.97,87.09,83.62,91.69,74.81,85,0.06,0.03,236.13,3.83,0,18.57,231,1012,96,76.28,2022,9,12,0,3,37,Fall,15.97,8.07,Warm,83.073905,18.57,Calm,80.21,Light,1,0.12,Very Humid,Oppressive,Moderate,86.84749245,0.7837,72.36885949,0.159908759,7.841140511,6817.85,0.2298
Apopka,13/09/2022,78.88,74.43,87.6,85.99,83.26,88.59,74.66,88,0.52,0.3,235.59,3.3,0.02,28.18,221,1010,96,75.81,2022,9,13,1,3,37,Fall,13.17,5.33,Warm,81.458752,28.16,Calm,78.88,Heavy,1,1.2,Very Humid,Oppressive,Moderate,84.10778638,1.616,72.36885949,0.159908759,6.511140511,6941.44,1.716
Apopka,14/09/2022,78.07,72.91,87.78,85.17,82.62,88.2,74.4,89,0.02,0.01,185.28,4.08,0.02,26.93,58,1011,96,75.41,2022,9,14,2,3,37,Fall,14.87,5.58,Warm,80.440159,26.91,Calm,78.07,Light,1,0.04,Very Humid,Oppressive,Low,86.08287576,0.6067,72.36885949,0.159908759,5.701140511,6948.23,0.0816
Apopka,15/09/2022,78.18,71.87,90.46,85.56,81.99,90.25,72.93,85,0.04,0.02,244.74,3.92,0.02,18.61,91,1014,96,74.41,2022,9,15,3,3,37,Fall,18.59,8.26,Warm,80.47449,18.59,Calm,78.18,Light,1,0.08,Very Humid,Oppressive,Moderate,88.31970868,0.6458,72.36885949,0.159908759,5.811140511,6645.3,0.1568
Apopka,16/09/2022,77.11,73.44,89.98,85.26,83.17,87.75,74.23,92,0.32,0.08,173.98,3.78,0.02,20.74,80,1015,96,75.02,2022,9,16,4,3,37,Fall,16.54,4.58,Warm,79.268596,20.72,Calm,77.11,Moderate,1,0.32,Very Humid,Oppressive,Low,83.76195109,1.1467,72.36885949,0.159908759,4.741140511,7094.12,1.2096
Apopka,17/09/2022,76.61,72.86,86.85,84.03,81.57,86.86,72.99,89,0.01,0.01,207.09,4.55,0.02,26.6,73,1014,96,74.01,2022,9,17,5,3,37,Fall,13.99,5.29,Warm,78.551357,26.58,Calm,76.61,Light,1,0.04,Very Humid,Oppressive,Moderate,88.27184032,0.5325,72.36885949,0.159908759,4.241140511,6818.29,0.0455
Apopka,18/09/2022,77.62,72.5,86.09,84.68,81.95,88.5,73.11,87,0,0,198.49,3.63,0,10.38,261,1011,96,74.38,2022,9,18,6,3,37,Fall,13.59,6.55,Warm,79.807702,10.38,Calm,77.62,No Rain,0,0,Very Humid,Oppressive,Low,86.47332577,0.5262,72.36885949,0.159908759,5.251140511,6752.94,0
Apopka,19/09/2022,78.18,71.91,87.48,85.56,82.65,88.56,73.06,85,0,0,182.48,3.7,0,19.95,67,1010,96,74.5,2022,9,19,0,3,38,Fall,15.57,5.91,Warm,80.47449,19.95,Calm,78.18,No Rain,0,0,Very Humid,Oppressive,Low,87.70622172,0.557,72.36885949,0.159908759,5.811140511,6645.3,0
Apopka,20/09/2022,78.5,73.6,88.41,85.91,83.03,89.19,74.63,89,0.05,0.03,246.63,3.88,0.02,19.15,63,1011,96,75.69,2022,9,20,1,3,38,Fall,14.81,6.16,Warm,80.99645,19.13,Calm,78.5,Light,1,0.12,Very Humid,Oppressive,Moderate,85.26647312,0.6802,72.36885949,0.159908759,6.131140511,6986.5,0.194
Apopka,21/09/2022,78.3,72.73,86.58,85.22,82.9,87.13,73.69,87,0.02,0.02,182.7,5.69,0.09,23.93,40,1009,96,74.97,2022,9,21,2,3,38,Fall,13.85,4.23,Warm,80.68293,23.84,Light,78.3,Light,1,0.08,Very Humid,Oppressive,Low,88.31865847,0.6826,72.36885949,0.159908759,5.931140511,6812.1,0.1138
Apopka,22/09/2022,80.4,72.66,90.77,85.62,82.31,89.69,71.88,78,0,0,235.92,3.7,0.02,13.51,14,1008,96,74.32,2022,9,22,3,3,38,Fall,18.11,7.38,Warm,83.07696,13.49,Calm,80.4,No Rain,0,0,Humid,Oppressive,Moderate,88.5365114,0.668,72.36885949,0.159908759,8.031140511,6271.2,0
Apopka,23/09/2022,80.7,75.24,89.01,86.03,83.41,88.93,74.58,82,0,0,216.43,6.96,0.27,21.38,4,1010,96,76.24,2022,9,23,4,3,38,Fall,13.77,5.52,Warm,83.59542,21.11,Light,80.7,No Rain,0,0,Very Humid,Oppressive,Moderate,86.76980628,0.8134,72.36885949,0.159908759,8.331140511,6617.4,0
Apopka,24/09/2022,78.18,71.64,86.99,85.77,83.08,88.57,68.63,75,0,0,226.7,5.74,0.34,19.1,56,1013,96,71.53,2022,9,24,5,3,38,Fall,15.35,5.49,Warm,80.20455,18.76,Light,78.18,No Rain,0,0,Humid,Uncomfortable,Moderate,89.72996376,0.6386,72.36885949,0.159908759,5.811140511,5863.5,0
Apopka,25/09/2022,78.15,70.65,88.16,85.26,82.76,87.98,71.27,80,0,0,165.54,4.63,0.02,15.26,58,1010,96,73.27,2022,9,25,6,3,38,Fall,17.51,5.22,Warm,80.3016,15.24,Calm,78.15,No Rain,0,0,Humid,Oppressive,Low,93.75412266,0.5927,72.36885949,0.159908759,5.781140511,6252,0
Apopka,26/09/2022,80.37,72.73,91.94,85.92,83.12,89.17,72.88,80,0,0,198.33,4.05,0.09,17.49,68,1009,96,74.98,2022,9,26,0,3,39,Fall,19.21,6.05,Warm,83.10768,17.4,Calm,80.37,No Rain,0,0,Humid,Oppressive,Low,90.80120001,0.6805,72.36885949,0.159908759,8.001140511,6429.6,0
Apopka,27/09/2022,76.65,73.65,84.56,85.17,83.32,87.55,74.35,93,0.46,0.27,75.43,4.1,0.05,18.28,67,1009,96,74.98,2022,9,27,1,3,39,Fall,10.91,4.23,Warm,78.690885,18.23,Calm,76.65,Moderate,1,1.08,Very Humid,Oppressive,Low,84.24373565,1.4165,72.36885949,0.159908759,4.281140511,7128.45,1.886
Apopka,28/09/2022,72.86,70.79,74.44,80.37,76.96,83.25,72.05,97,4,0.26,30.88,14.61,1.5,50.15,51,1005,96,72.29,2022,9,28,2,3,39,Fall,3.65,6.29,Warm,73.775486,48.65,Moderate,72.86,Very Heavy,1,1.04,Very Humid,Oppressive,Low,59.84429235,8.7274,72.36885949,0.159908759,0.491140511,7067.42,58.44
Apopka,29/09/2022,69.06,62.69,73.6,73.75,71.35,76.8,67.17,94,6.07,0.28,40.06,19.48,0.89,61.31,345,999,96,67.77,2022,9,29,3,3,39,Fall,10.91,5.45,Mild,68.768412,60.42,Fresh,69.06,Very Heavy,1,1.12,Very Humid,Uncomfortable,Low,49.64089478,12.9662,72.36885949,0.159908759,-3.308859489,6491.64,118.2436
Apopka,30/09/2022,69.29,63.84,78.13,73.47,69.62,79.25,61.15,76,0,0,254.21,7.36,0.02,22.44,307,1005,96,64.04,2022,9,30,4,3,39,Fall,14.29,9.63,Mild,69.111932,22.42,Light,69.29,No Rain,0,0,Humid,Sticky,Moderate,90.55372104,0.3299,72.36885949,0.159908759,-3.078859489,5266.04,0
Apopka,01/10/2022,71.47,60.91,81.19,77.36,72.91,82.63,63.05,76,0,0,261.33,3.45,0.02,11.5,332,1008,96,65.93,2022,10,1,5,4,39,Fall,20.28,9.72,Warm,71.838676,11.48,Calm,71.47,No Rain,0,0,Humid,Sticky,Moderate,91.8370483,0.2115,72.36885949,0.159908759,-0.898859489,5431.72,0
Apopka,02/10/2022,73.32,64.2,84,79.07,74.93,83.88,62.88,73,0,0,267.05,4.6,0,16.2,281,1010,96,66.43,2022,10,2,6,4,39,Fall,19.8,8.95,Warm,74.119788,16.2,Calm,73.32,No Rain,0,0,Humid,Sticky,Moderate,91.86906953,0.35,72.36885949,0.159908759,0.951140511,5352.36,0
Apopka,03/10/2022,70.82,63.66,81,79.67,76.1,83.8,63.15,78,0,0,229.55,6.32,0.13,19.1,14,1011,96,65.77,2022,10,3,0,4,40,Fall,17.34,7.7,Warm,71.031068,18.97,Light,70.82,No Rain,0,0,Humid,Sticky,Moderate,94.6022374,0.2938,72.36885949,0.159908759,-1.548859489,5523.96,0
Apopka,04/10/2022,67.76,59,79.29,78.91,75.49,82.44,60.52,79,0,0,229.81,6.84,0.05,20.31,15,1013,96,63.13,2022,10,4,1,4,40,Fall,20.29,6.95,Mild,67.176032,20.26,Light,67.76,No Rain,0,0,Humid,Sticky,Moderate,93.1452217,0.3856,72.36885949,0.159908759,-4.608859489,5353.04,0
Apopka,05/10/2022,69.13,59.32,79.52,78.6,74.7,83.01,59.72,74,0,0,248.93,4.52,0.05,13.69,20,1013,96,63.13,2022,10,5,2,4,40,Fall,20.2,8.31,Mild,68.917546,13.64,Calm,69.13,No Rain,0,0,Humid,Comfortable,Moderate,93.96721267,0.2243,72.36885949,0.159908759,-3.238859489,5115.62,0
Apopka,06/10/2022,70.98,60.12,81.54,79.14,75.13,83.52,59.41,70,0,0,253.11,3.57,0.09,12.55,75,1015,96,63.6,2022,10,6,3,4,40,Fall,21.42,8.39,Warm,71.20638,12.46,Calm,70.98,No Rain,0,0,Humid,Comfortable,Moderate,88.34268907,0.1918,72.36885949,0.159908759,-1.388859489,4968.6,0
Apopka,07/10/2022,71.33,60.58,83.25,79.5,75.6,83.66,61.64,74,0,0,248.09,3.69,0.05,12.28,50,1016,96,65.02,2022,10,7,4,4,40,Fall,22.67,8.06,Warm,71.654786,12.23,Calm,71.33,No Rain,0,0,Humid,Sticky,Moderate,91.21594001,0.2141,72.36885949,0.159908759,-1.038859489,5278.42,0
Apopka,08/10/2022,72.58,61.23,84.9,79.85,76.12,83.84,62.75,75,0,0,250.25,4.46,0.02,21.83,50,1016,96,66.11,2022,10,8,5,4,40,Fall,23.67,7.72,Warm,73.21855,21.81,Calm,72.58,No Rain,0,0,Humid,Sticky,Moderate,93.29844191,0.3074,72.36885949,0.159908759,0.211140511,5443.5,0
Apopka,09/10/2022,73.59,62.11,85.53,79.97,76.59,83.37,66.46,80,0,0,210.48,5.72,0.05,18.88,49,1016,96,68.75,2022,10,9,6,4,40,Fall,23.42,6.78,Warm,74.53776,18.83,Light,73.59,No Rain,0,0,Humid,Uncomfortable,Moderate,95.8795954,0.4083,72.36885949,0.159908759,1.221140511,5887.2,0
Apopka,10/10/2022,76.49,69.19,88.99,81.19,78.33,84.69,69.33,80,0,0,189.19,5.69,0.2,15.66,33,1016,96,71.49,2022,10,10,0,4,41,Fall,19.8,6.36,Warm,78.20336,15.46,Light,76.49,No Rain,0,0,Humid,Uncomfortable,Low,94.218618,0.5521,72.36885949,0.159908759,4.121140511,6119.2,0
Apopka,11/10/2022,77.7,69.8,88.5,81.97,79.07,85.21,70.53,80,0.02,0.02,198.25,5.24,0.63,19.57,58,1017,96,72.65,2022,10,11,1,4,41,Fall,18.7,6.14,Warm,79.7328,18.94,Light,77.7,Light,1,0.08,Humid,Oppressive,Low,94.7455439,0.6346,72.36885949,0.159908759,5.331140511,6216,0.1048
Apopka,12/10/2022,76.39,71.37,85.87,81.79,80.1,83.55,72.88,90,0.07,0.04,101.74,3.69,0,14.14,92,1014,96,73.88,2022,10,12,2,4,41,Fall,14.5,3.45,Warm,78.28783,14.14,Calm,76.39,Light,1,0.16,Very Humid,Oppressive,Low,85.31872036,0.6071,72.36885949,0.159908759,4.021140511,6875.1,0.2583
Apopka,13/10/2022,76.72,71.62,82.13,80.54,78.84,82.17,72.81,88,0,0,123.01,3.68,0.11,12.75,241,1009,96,73.92,2022,10,13,3,4,41,Fall,10.51,3.33,Warm,78.671488,12.64,Calm,76.72,No Rain,0,0,Very Humid,Oppressive,Low,86.46689772,0.4832,72.36885949,0.159908759,4.351140511,6751.36,0
Apopka,14/10/2022,76.88,68.99,86.76,80.82,78.04,84.22,68.67,78,0,0,206.29,5.49,0.02,16.31,37,1010,96,71.18,2022,10,14,4,4,41,Fall,17.77,6.18,Warm,78.650912,16.29,Light,76.88,No Rain,0,0,Humid,Uncomfortable,Moderate,93.27107145,0.5636,72.36885949,0.159908759,4.511140511,5996.64,0
Apopka,15/10/2022,75.89,68.09,85.89,81.3,78.89,83.86,67.37,77,0,0,186.5,6.43,0.67,19.26,61,1014,96,70.04,2022,10,15,5,4,41,Fall,17.8,4.97,Warm,77.386649,18.59,Light,75.89,No Rain,0,0,Humid,Uncomfortable,Low,90.55809592,0.5517,72.36885949,0.159908759,3.521140511,5843.53,0
Apopka,16/10/2022,75.42,65.88,87.3,81.25,77.92,85.01,66.6,77,0,0,222.61,5.34,0.18,17.36,76,1014,96,69.4,2022,10,16,6,4,41,Fall,21.42,7.09,Warm,76.797222,17.18,Light,75.42,No Rain,0,0,Humid,Uncomfortable,Moderate,93.88039608,0.4846,72.36885949,0.159908759,3.051140511,5807.34,0
Apopka,17/10/2022,75.6,69.3,85.62,81.92,79.32,84.58,69.67,83,0,0,155.58,3.84,0.05,26.93,178,1009,96,71.46,2022,10,17,0,4,42,Fall,16.32,5.26,Warm,77.13384,26.88,Calm,75.6,No Rain,0,0,Very Humid,Uncomfortable,Low,91.02333632,0.4336,72.36885949,0.159908759,3.231140511,6274.8,0
Apopka,18/10/2022,73.95,63.18,80.89,81.55,79.45,84.31,66.36,79,0,0,170.29,6.48,0.34,17.02,288,1007,96,68.79,2022,10,18,1,4,42,Fall,17.71,4.86,Warm,74.979765,16.68,Light,73.95,No Rain,0,0,Humid,Uncomfortable,Low,92.96035805,0.4567,72.36885949,0.159908759,1.581140511,5842.05,0
Apopka,19/10/2022,56.36,48.6,66.49,78.08,75.13,82.2,39.89,55,0,0,173.23,7.35,0.36,21.52,358,1014,96,48.12,2022,10,19,2,4,42,Fall,17.89,7.07,Mild,53.88434,21.16,Light,56.36,No Rain,0,0,Comfortable,Dry,Low,68.3697419,0.976,72.36885949,0.159908759,-16.00885949,3099.8,0
Apopka,20/10/2022,59.31,47.86,70.97,74.45,71.26,77.2,47.45,66,0,0,146.89,4.3,0.02,16.44,0,1014,96,52.78,2022,10,20,3,4,42,Fall,23.11,5.94,Mild,56.981718,16.42,Calm,59.31,No Rain,0,0,Humid,Dry,Low,81.94766955,0.7065,72.36885949,0.159908759,-13.05885949,3914.46,0
Apopka,21/10/2022,63.97,53.94,76.14,75.18,71.83,79.12,47.27,58,0,0,230.47,6.26,0.07,18.81,19,1014,96,54.66,2022,10,21,4,4,42,Fall,22.2,7.29,Mild,62.815858,18.74,Light,63.97,No Rain,0,0,Comfortable,Dry,Moderate,78.04933881,0.5519,72.36885949,0.159908759,-8.398859489,3710.26,0
Apopka,22/10/2022,66.78,56.41,81.36,75.61,72.1,79.29,56.49,70,0,0,202.9,6.67,0.07,21.16,20,1015,96,60.44,2022,10,22,5,4,42,Fall,24.95,7.19,Mild,66.03618,21.09,Light,66.78,No Rain,0,0,Humid,Comfortable,Moderate,86.84405623,0.4278,72.36885949,0.159908759,-5.588859489,4674.6,0
Apopka,23/10/2022,69.39,57.27,82.81,76.67,72.81,81.01,59.37,74,0,0,222.93,3.91,0.02,14.34,13,1016,96,63.02,2022,10,23,6,4,42,Fall,25.54,8.2,Mild,69.241038,14.32,Calm,69.39,No Rain,0,0,Humid,Comfortable,Moderate,92.42259618,0.1869,72.36885949,0.159908759,-2.978859489,5134.86,0
Apopka,24/10/2022,71.37,61.84,83.35,77.81,74.75,80.94,64.11,80,0,0,174.15,4.76,0,16.42,54,1016,96,66.55,2022,10,24,0,4,43,Fall,21.51,6.19,Warm,71.73168,16.42,Calm,71.37,No Rain,0,0,Humid,Sticky,Low,98.1954733,0.2589,72.36885949,0.159908759,-0.998859489,5709.6,0
Apopka,25/10/2022,70.89,60.03,82.33,78.15,74.5,82.22,62.36,77,0,0,220.83,3.6,0,11.59,81,1013,96,65.31,2022,10,25,1,4,43,Fall,22.3,7.72,Warm,71.116149,11.59,Calm,70.89,No Rain,0,0,Humid,Sticky,Moderate,93.29155706,0.1885,72.36885949,0.159908759,-1.478859489,5458.53,0
Apopka,26/10/2022,74.2,61.65,85.05,79.19,75.51,83.21,66.47,78,0,0,204.48,3.51,0.02,12.26,216,1010,96,68.94,2022,10,26,2,4,43,Fall,23.4,7.7,Warm,75.28108,12.24,Calm,74.2,No Rain,0,0,Humid,Uncomfortable,Moderate,91.73659043,0.3504,72.36885949,0.159908759,1.831140511,5787.6,0
Apopka,27/10/2022,76.25,69.94,85.62,80.92,78.21,84.18,70.74,84,0,0,165.39,4.18,0.18,16.08,132,1011,96,72.36,2022,10,27,3,4,43,Fall,15.68,5.97,Warm,77.9825,15.9,Calm,76.25,No Rain,0,0,Very Humid,Oppressive,Low,90.89311845,0.4797,72.36885949,0.159908759,3.881140511,6405,0
Apopka,28/10/2022,73.5,68.4,81.88,80.13,78.44,82.74,71.06,92,0.51,0.12,98.87,4.66,0.02,18.25,41,1016,96,71.78,2022,10,28,4,4,43,Fall,13.48,4.3,Warm,74.5626,18.23,Calm,73.5,Heavy,1,0.48,Very Humid,Oppressive,Low,88.38766833,1.3814,72.36885949,0.159908759,1.131140511,6762,2.3766
Apopka,29/10/2022,74.64,68.04,84.85,79.04,76.69,82.29,70.01,87,0,0,141.04,5.68,0.05,16.93,39,1017,96,71.4,2022,10,29,5,4,43,Fall,16.81,5.6,Warm,75.972144,16.88,Light,74.64,No Rain,0,0,Very Humid,Oppressive,Low,90.54839356,0.4592,72.36885949,0.159908759,2.271140511,6493.68,0
Apopka,30/10/2022,74.91,68.56,85.75,80.29,77.54,83.95,69.02,84,0,0,196.37,5.44,0.25,16.49,61,1014,96,70.82,2022,10,30,6,4,43,Fall,17.19,6.41,Warm,76.271052,16.24,Light,74.91,No Rain,0,0,Very Humid,Uncomfortable,Low,93.11710634,0.4631,72.36885949,0.159908759,2.541140511,6292.44,0
Apopka,31/10/2022,75.96,67.96,86.04,80.85,77.49,84.72,69.93,83,0,0,197.65,3.52,0.05,11.36,68,1012,96,71.74,2022,10,31,0,4,44,Fall,18.08,7.23,Warm,77.592444,11.31,Calm,75.96,No Rain,0,0,Very Humid,Uncomfortable,Low,89.91441632,0.4388,72.36885949,0.159908759,3.591140511,6304.68,0
Apopka,01/11/2022,78,71.13,87.85,82.08,79.43,85.42,72.75,85,0,0,177.08,3.33,0,15.79,51,1016,96,74.24,2022,11,1,1,4,44,Fall,16.72,5.99,Warm,80.244,15.79,Calm,78,No Rain,0,0,Very Humid,Oppressive,Low,86.78273587,0.5332,72.36885949,0.159908759,5.631140511,6630,0
Apopka,02/11/2022,77.7,71.1,88.75,82.66,80.06,85.5,72.63,86,0,0,174.46,4.59,0.11,15.7,65,1018,96,74.07,2022,11,2,2,4,44,Fall,17.65,5.44,Warm,79.88526,15.59,Calm,77.7,No Rain,0,0,Very Humid,Oppressive,Low,89.78952718,0.5686,72.36885949,0.159908759,5.331140511,6682.2,0
Apopka,03/11/2022,74.54,67.08,82.96,82.18,79.97,84.16,68.79,84,0,0,159.22,6.68,0.07,19.21,41,1017,96,70.56,2022,11,3,3,4,44,Fall,15.88,4.19,Warm,75.798488,19.14,Light,74.54,No Rain,0,0,Very Humid,Uncomfortable,Low,89.88186208,0.4942,72.36885949,0.159908759,2.171140511,6261.36,0
Apopka,04/11/2022,72.93,66.45,83.79,80.33,77.81,82.81,66.49,82,0.01,0.01,179.53,7.79,0.38,21.72,38,1016,96,68.56,2022,11,4,4,4,44,Fall,17.34,5,Warm,73.722858,21.34,Light,72.93,Light,1,0.04,Very Humid,Uncomfortable,Low,89.12970511,0.4781,72.36885949,0.159908759,0.561140511,5980.26,0.0779
Apopka,05/11/2022,74.15,67.24,84.13,79.44,77.36,81.34,70.1,88,0.02,0.01,156.23,5.24,0.18,22.59,66,1013,96,71.31,2022,11,5,5,4,44,Fall,16.89,3.98,Warm,75.35516,22.41,Light,74.15,Light,1,0.04,Very Humid,Oppressive,Low,91.38285531,0.4571,72.36885949,0.159908759,1.781140511,6525.2,0.1048
Apopka,06/11/2022,76.34,70.39,86.83,79.51,77.52,81.7,71.23,85,0.04,0.04,163.45,6.2,0.18,28.25,75,1014,96,72.73,2022,11,6,6,4,44,Fall,16.44,4.18,Warm,78.11837,28.07,Light,76.34,Light,1,0.16,Very Humid,Oppressive,Low,89.45020711,0.645,72.36885949,0.159908759,3.971140511,6488.9,0.248
Apopka,07/11/2022,73.59,66.49,83.88,78.48,76.12,80.71,67.33,83,0.02,0.01,168.17,7.34,0.05,26.6,37,1016,96,69.31,2022,11,7,0,4,45,Fall,17.39,4.59,Warm,74.573301,26.55,Light,73.59,Light,1,0.04,Very Humid,Uncomfortable,Low,89.30021474,0.5131,72.36885949,0.159908759,1.221140511,6107.97,0.1468
Apopka,08/11/2022,71.82,68.41,79.52,77.56,76.32,79.05,69.67,93,0.72,0.14,124.41,8.73,0.22,29.84,20,1015,96,70.33,2022,11,8,1,4,45,Fall,11.11,2.73,Warm,72.378558,29.62,Light,71.82,Heavy,1,0.56,Very Humid,Uncomfortable,Low,79.61596874,1.8802,72.36885949,0.159908759,-0.548859489,6679.26,6.2856
Apopka,09/11/2022,67.47,65.43,71.26,74.37,73.09,76.24,66.82,98,1.35,0.13,38.12,9.63,0.34,26.19,9,1011,96,67.03,2022,11,9,2,4,45,Fall,5.83,3.15,Mild,66.651798,25.85,Light,67.47,Very Heavy,1,0.52,Very Humid,Uncomfortable,Low,73.40265687,3.2117,72.36885949,0.159908759,-4.898859489,6612.06,13.0005
Apopka,10/11/2022,71.78,68.86,73.71,72.78,72.55,73.08,70.13,95,3.17,0.4,36.1,16.32,0.74,53.44,129,997,96,70.63,2022,11,10,3,4,45,Fall,4.85,0.53,Warm,72.33803,52.7,Fresh,71.78,Very Heavy,1,1.6,Very Humid,Oppressive,Low,57.1001421,7.0818,72.36885949,0.159908759,-0.588859489,6819.1,51.7344
Apopka,11/11/2022,73.65,69.17,82.74,73.81,72.34,75.58,70.86,91,0.17,0.1,114.15,5.88,0.29,24.78,197,1008,96,71.69,2022,11,11,4,4,45,Fall,13.57,3.24,Warm,74.746095,24.49,Light,73.65,Moderate,1,0.4,Very Humid,Oppressive,Low,87.83707928,0.7577,72.36885949,0.159908759,1.281140511,6702.15,0.9996
Apopka,12/11/2022,72.41,68.07,81.1,74.72,72.12,77.94,67.76,87,0,0,172.77,4.09,0.27,13.29,241,1012,96,69.22,2022,11,12,5,4,45,Fall,13.03,5.82,Warm,73.101911,13.02,Calm,72.41,No Rain,0,0,Very Humid,Uncomfortable,Low,90.89039772,0.2841,72.36885949,0.159908759,0.041140511,6299.67,0
Apopka,13/11/2022,68.5,61.02,76.75,74.42,72.57,76.64,64.71,88,0,0,97,5.69,0.05,17.69,233,1013,96,65.98,2022,11,13,6,4,45,Fall,15.73,4.07,Mild,68.0644,17.64,Light,68.5,No Rain,0,0,Very Humid,Sticky,Low,91.88224931,0.3026,72.36885949,0.159908759,-3.868859489,6028,0
Apopka,14/11/2022,68.62,58.05,81.63,74.44,71.44,77.81,61.56,79,0,0,164.85,5.13,0.05,15.05,40,1015,96,64.05,2022,11,14,0,4,46,Fall,23.58,6.37,Mild,68.260234,15,Light,68.62,No Rain,0,0,Humid,Sticky,Low,98.43106294,0.2742,72.36885949,0.159908759,-3.748859489,5420.98,0
Apopka,15/11/2022,71.75,62.76,80.38,74.95,72.9,76.89,67.74,88,0,0,92.35,2.82,0.02,12.33,155,1015,96,69.01,2022,11,15,1,4,46,Fall,17.62,3.99,Warm,72.2582,12.31,Calm,71.75,No Rain,0,0,Very Humid,Uncomfortable,Low,87.05866436,0.2003,72.36885949,0.159908759,-0.618859489,6314,0
Apopka,16/11/2022,70.8,61.11,76.95,75.36,74.35,77.11,67.76,90,0,0,71.78,5.47,0.09,18.12,261,1016,96,68.72,2022,11,16,2,4,46,Fall,15.84,2.76,Warm,71.0376,18.03,Light,70.8,No Rain,0,0,Very Humid,Uncomfortable,Low,91.38224594,0.2588,72.36885949,0.159908759,-1.568859489,6372,0
Apopka,17/11/2022,55.88,48.69,65.28,72.1,69.82,74.37,42.84,63,0,0,159.42,5.57,0.18,20.8,11,1019,96,49.14,2022,11,17,3,4,46,Fall,16.59,4.55,Mild,52.944452,20.62,Light,55.88,No Rain,0,0,Humid,Dry,Low,78.54300408,0.9288,72.36885949,0.159908759,-16.48885949,3520.44,0
Apopka,18/11/2022,55.15,48.85,66.02,69.87,67.5,72.55,42.48,63,0,0,164.23,5.92,0.25,15.21,22,1020,96,48.65,2022,11,18,4,4,46,Fall,17.17,5.05,Mild,52.062685,14.96,Light,55.15,No Rain,0,0,Humid,Dry,Low,77.12783544,0.9793,72.36885949,0.159908759,-17.21885949,3474.45,0
Apopka,19/11/2022,58.72,49.03,72.57,69.45,66.38,72.75,51.93,79,0,0,155.37,6.66,0.2,21,23,1020,96,54.81,2022,11,19,5,4,46,Fall,23.54,6.37,Mild,55.779304,20.8,Light,58.72,No Rain,0,0,Humid,Comfortable,Low,88.20871809,0.8304,72.36885949,0.159908759,-13.64885949,4638.88,0
Apopka,20/11/2022,54.6,52.25,57.29,67.86,65.61,70.47,48.12,80,0.27,0.04,26.27,7.9,0.09,20.4,24,1020,96,51.06,2022,11,20,6,4,46,Fall,5.04,4.86,Mild,50.5344,20.31,Light,54.6,Moderate,1,0.16,Humid,Dry,Low,82.85564145,1.626,72.36885949,0.159908759,-17.76885949,4368,2.133
Apopka,21/11/2022,65.39,53.02,77.2,67.36,65.1,70.5,61.3,88,0,0,129.48,8.76,0.54,23.13,39,1020,96,62.77,2022,11,21,0,4,47,Fall,24.18,5.4,Mild,64.051256,22.59,Light,65.39,No Rain,0,0,Very Humid,Sticky,Low,81.45034736,0.5809,72.36885949,0.159908759,-6.978859489,5754.32,0
Apopka,22/11/2022,67.48,63.73,73.74,69.83,68.58,71.44,65.88,95,0.01,0.01,65.42,8.15,0.11,19.71,25,1018,96,66.41,2022,11,22,1,4,47,Fall,10.01,2.86,Mild,66.68998,19.6,Light,67.48,Light,1,0.04,Very Humid,Uncomfortable,Low,79.59765272,0.472,72.36885949,0.159908759,-4.888859489,6410.6,0.0815
Apopka,23/11/2022,67.2,62.69,76.24,71.13,69.55,73.02,65.49,95,0,0,81.94,6.1,0.02,15.93,17,1015,96,66.06,2022,11,23,2,4,47,Fall,13.55,3.47,Mild,66.3222,15.91,Light,67.2,No Rain,0,0,Very Humid,Uncomfortable,Low,85.14578824,0.384,72.36885949,0.159908759,-5.168859489,6384,0
Apopka,24/11/2022,70.83,64.38,81.79,72.56,70.77,74.93,68.75,94,0,0,102.23,3.98,0.02,11.01,58,1015,96,69.4,2022,11,24,3,4,47,Fall,17.41,4.16,Warm,71.087466,10.99,Calm,70.83,No Rain,0,0,Very Humid,Uncomfortable,Low,86.72311251,0.2007,72.36885949,0.159908759,-1.538859489,6658.02,0
Apopka,25/11/2022,72.66,65.21,81.88,73.81,71.55,76.28,69.89,92,0.01,0.01,118.04,3.3,0.02,12.15,274,1013,96,70.73,2022,11,25,4,4,47,Fall,16.67,4.73,Warm,73.467576,12.13,Calm,72.66,Light,1,0.04,Very Humid,Uncomfortable,Low,85.10054597,0.285,72.36885949,0.159908759,0.291140511,6684.72,0.033
Apopka,26/11/2022,72.42,68.49,79.14,74.64,72.91,77.05,69.77,92,0,0,113.68,3.83,0.18,13.06,54,1014,96,70.57,2022,11,26,5,4,47,Fall,10.65,4.14,Warm,73.154712,12.88,Calm,72.42,No Rain,0,0,Very Humid,Uncomfortable,Low,86.72287538,0.2742,72.36885949,0.159908759,0.051140511,6662.64,0
Apopka,27/11/2022,74.24,68.47,81,75.58,73.78,77.81,70.88,90,0.09,0.08,121.77,6.39,0.43,21,221,1012,96,71.88,2022,11,27,6,4,47,Fall,12.53,4.03,Warm,75.49928,20.57,Light,74.24,Light,1,0.32,Very Humid,Oppressive,Low,86.74725731,0.6476,72.36885949,0.159908759,1.871140511,6681.6,0.5751
Apopka,28/11/2022,67.48,58.19,75.78,73.79,72.18,75.83,59.25,77,0,0,142.25,4.11,0.05,14.05,259,1014,96,62.28,2022,11,28,0,4,48,Fall,17.59,3.65,Mild,66.839668,14,Calm,67.48,No Rain,0,0,Humid,Comfortable,Low,93.89314487,0.2904,72.36885949,0.159908759,-4.888859489,5195.96,0
Apopka,29/11/2022,67.37,56.32,80.51,71.69,68.7,74.77,59.84,80,0,0,171.04,4.14,0.02,15.14,95,1016,96,62.58,2022,11,29,1,4,48,Fall,24.19,6.07,Mild,66.67568,15.12,Calm,67.37,No Rain,0,0,Humid,Comfortable,Low,95.86856034,0.2971,72.36885949,0.159908759,-4.998859489,5389.6,0
Apopka,30/11/2022,69.37,62.76,81.66,72.79,70.18,75.79,64.86,87,0,0,136.27,3.91,0.05,28.99,136,1016,96,66.36,2022,11,30,2,4,48,Fall,18.9,5.61,Mild,69.189127,28.94,Calm,69.37,No Rain,0,0,Very Humid,Sticky,Low,91.61931711,0.1879,72.36885949,0.159908759,-2.998859489,6035.19,0
Apopka,01/12/2022,64.75,57.65,74.44,72.43,70.3,74.64,58.06,80,0,0,171.21,7.6,0.22,21.5,37,1022,96,60.59,2022,12,1,3,4,48,Winter,16.79,4.34,Mild,63.364,21.28,Light,64.75,No Rain,0,0,Humid,Comfortable,Low,89.79843604,0.5665,72.36885949,0.159908759,-7.618859489,5180,0
Apopka,02/12/2022,67.37,58.15,78.55,71.91,69.24,74.79,58.87,76,0,0,172.65,6.08,0.13,21.77,62,1023,96,62.02,2022,12,2,4,4,48,Winter,20.4,5.55,Mild,66.710396,21.64,Light,67.37,No Rain,0,0,Humid,Comfortable,Low,92.96803121,0.3747,72.36885949,0.159908759,-4.998859489,5120.12,0
Apopka,03/12/2022,68.49,60.33,81,72.23,69.67,75.04,59.99,77,0,0,148.95,3.12,0.05,15.17,68,1023,96,63.07,2022,12,3,5,4,48,Winter,20.67,5.37,Mild,68.106309,15.12,Calm,68.49,No Rain,0,0,Humid,Comfortable,Low,91.74006772,0.2003,72.36885949,0.159908759,-3.878859489,5273.73,0
Apopka,04/12/2022,67.16,57.15,77.45,72.13,69.26,75.06,61.57,84,0,0,160.86,3.03,0.02,11.95,328,1018,96,63.55,2022,12,4,6,4,48,Winter,20.3,5.8,Mild,66.372752,11.93,Calm,67.16,No Rain,0,0,Very Humid,Sticky,Low,89.89772311,0.2632,72.36885949,0.159908759,-5.208859489,5641.44,0
Apopka,05/12/2022,67.67,61,75.54,73.05,71.1,74.98,63.96,88,0,0,103.73,2.88,0.05,9.89,48,1016,96,65.22,2022,12,5,0,4,49,Winter,14.54,3.88,Mild,66.993368,9.84,Calm,67.67,No Rain,0,0,Very Humid,Sticky,Low,87.03707056,0.2317,72.36885949,0.159908759,-4.698859489,5954.96,0
Apopka,06/12/2022,69.01,60.37,78.84,72.92,70.59,75.76,63.27,83,0,0,129.96,2.85,0,8.97,77,1019,96,65.24,2022,12,6,1,4,49,Winter,18.47,5.17,Mild,68.738839,8.97,Calm,69.01,No Rain,0,0,Very Humid,Sticky,Low,91.19603112,0.1635,72.36885949,0.159908759,-3.358859489,5727.83,0
Apopka,07/12/2022,68.99,60.15,79.88,73.2,70.47,75.87,64.23,86,0,0,134.39,2.77,0.02,10.63,42,1022,96,65.84,2022,12,7,2,4,49,Winter,19.73,5.4,Mild,68.703362,10.61,Calm,68.99,No Rain,0,0,Very Humid,Sticky,Low,88.8990272,0.1613,72.36885949,0.159908759,-3.378859489,5933.14,0
Apopka,08/12/2022,69.14,61.16,78.6,73.51,70.84,76.41,64.53,86,0.01,0.01,165.86,2.71,0.02,10.47,298,1019,96,66.08,2022,12,8,3,4,49,Winter,17.44,5.57,Mild,68.895932,10.45,Calm,69.14,Light,1,0.04,Very Humid,Sticky,Low,88.8219523,0.1714,72.36885949,0.159908759,-3.228859489,5946.04,0.0271
Apopka,09/12/2022,68.12,60.66,77.95,73.21,70.57,75.96,63.56,87,0,0,166.5,3,0,10.2,309,1017,96,65.12,2022,12,9,4,4,49,Winter,17.29,5.39,Mild,67.580252,10.2,Calm,68.12,No Rain,0,0,Very Humid,Sticky,Low,88.32971425,0.214,72.36885949,0.159908759,-4.248859489,5926.44,0
Apopka,10/12/2022,66.79,61.56,76.68,73.29,71.24,75.97,63.22,89,0,0,145.23,5.49,0.05,18.19,316,1017,96,64.46,2022,12,10,5,4,49,Winter,15.12,4.73,Mild,65.847223,18.14,Light,66.79,No Rain,0,0,Very Humid,Sticky,Low,90.72393659,0.3801,72.36885949,0.159908759,-5.578859489,5944.31,0
Apopka,11/12/2022,63.95,59.59,68.43,73.23,72.16,74.23,60.72,89,0,0,64.77,4.81,0.29,13.53,12,1016,96,61.9,2022,12,11,6,4,49,Winter,8.84,2.07,Mild,62.173115,13.24,Calm,63.95,No Rain,0,0,Very Humid,Sticky,Low,89.49378386,0.4949,72.36885949,0.159908759,-8.418859489,5691.55,0
Apopka,12/12/2022,62.63,57.65,70.93,72.13,70.57,73.99,58.49,87,0.04,0.04,107.02,4.17,0.09,14.67,7,1014,96,60.06,2022,12,12,0,4,50,Winter,13.28,3.42,Mild,60.514073,14.58,Calm,62.63,Light,1,0.16,Very Humid,Comfortable,Low,88.28957546,0.6153,72.36885949,0.159908759,-9.738859489,5448.81,0.1668
Apopka,13/12/2022,64.56,56.93,74.25,71.23,69.39,72.86,61.51,90,0.01,0.01,109.25,7.15,0.85,20.02,63,1015,96,62.6,2022,12,13,1,4,50,Winter,17.32,3.47,Mild,62.94432,19.17,Light,64.56,Light,1,0.04,Very Humid,Sticky,Low,84.06603945,0.578,72.36885949,0.159908759,-7.808859489,5810.4,0.0715
Apopka,14/12/2022,70.58,65.59,79.25,72.46,70.77,74.84,65.04,84,0,0,134.85,6.45,0.22,19.01,136,1013,96,66.87,2022,12,14,2,4,50,Winter,13.66,4.07,Warm,70.740776,18.79,Light,70.58,No Rain,0,0,Very Humid,Uncomfortable,Low,92.90556358,0.287,72.36885949,0.159908759,-1.788859489,5928.72,0
Apopka,15/12/2022,68.89,61.11,71.28,71.96,70.83,73.49,66.37,92,0.77,0.2,10.16,6.51,0.2,27.04,202,1010,96,67.19,2022,12,15,3,4,50,Winter,10.17,2.66,Mild,68.553004,26.84,Light,68.89,Heavy,1,0.8,Very Humid,Uncomfortable,Low,87.08105834,1.8559,72.36885949,0.159908759,-3.478859489,6337.88,5.0127
Apopka,16/12/2022,57.37,50.22,65.73,68.84,67.17,70.75,46.75,69,0,0,125.63,4.05,0.02,16.44,355,1014,96,51.6,2022,12,16,4,4,50,Winter,15.51,3.58,Mild,54.494149,16.42,Calm,57.37,No Rain,0,0,Humid,Dry,Low,82.14531061,0.7935,72.36885949,0.159908759,-14.99885949,3958.53,0
Apopka,17/12/2022,58.21,46.62,67.68,66.23,63.9,68.02,47.44,69,0,0,110.4,3.62,0.02,12.53,48,1013,96,52.3,2022,12,17,5,4,50,Winter,21.06,4.12,Mild,55.525417,12.51,Calm,58.21,No Rain,0,0,Humid,Dry,Low,81.45156493,0.7343,72.36885949,0.159908759,-14.15885949,4016.49,0
Apopka,18/12/2022,55.51,44.63,65.23,66.44,64.72,68.32,45.13,70,0.02,0.02,148.7,4.45,0.02,14.94,2,1016,96,50.01,2022,12,18,6,4,50,Winter,20.6,3.6,Mild,52.16281,14.92,Calm,55.51,Light,1,0.08,Humid,Dry,Low,82.8290641,0.9425,72.36885949,0.159908759,-16.85885949,3885.7,0.089
Apopka,19/12/2022,56.09,42.52,70.38,64.02,60.73,67.32,45.16,68,0,0,169.41,5.04,0.11,14.83,48,1020,96,50.29,2022,12,19,0,4,51,Winter,27.86,6.59,Mild,52.968596,14.72,Light,56.09,No Rain,0,0,Humid,Dry,Low,83.44866099,0.8971,72.36885949,0.159908759,-16.27885949,3814.12,0
Apopka,20/12/2022,59.51,54.59,63.48,64.66,63.7,65.44,58.09,95,0.1,0.02,30.92,3.28,0.02,11.21,34,1019,96,58.64,2022,12,20,1,4,51,Winter,8.89,1.74,Mild,56.221385,11.19,Calm,59.51,Light,1,0.08,Very Humid,Comfortable,Low,78.43239346,0.8557,72.36885949,0.159908759,-12.85885949,5653.45,0.328
